product_id,product_name,brand_id,brand_name,category_id,category_name,size_value,size_unit,price,currency,date_collected,retailer_name,product_clean,brand_clean,category_clean,retailer_clean,reason_unmatched
PRDc1cfd765,"Liquid Solution,Boto-x Face Serum,Boto-x Stock Solution Facial Serum for Anti Aging,Hydrating Liquid Facial,Smooth FIne Lines & Anti Wrinkle,Essence",BRD7b6d2274,"Liquid Solution,Boto-x",CAT722a51fb,Face Serum,,,4.99,GBP,20251108_121214,Amazon.co.uk - Amazon.co.uk-Seller,liquid solution boto x face serum boto x stock solution facial serum for anti aging hydrating liquid facial smooth fine lines anti wrinkle essence,liquid solution boto x,face serum,amazon co uk amazon co uk seller,No match >= 70
PRDca2d45b1,Plantifique Face Serum,BRD79283a0f,Plantifique Face,CAT722a51fb,Face Serum,,,19.95,GBP,20251108_121214,Amazon.co.uk - Amazon.co.uk-Seller,plantifique face serum,plantifique face,face serum,amazon co uk amazon co uk seller,No match >= 70
PRD5e7549a2,revuele Comforting Face Serum,,,CAT722a51fb,Face Serum,,,4.73,GBP,20251108_121214,Makeup.uk,revuele comforting face serum,,face serum,makeup uk,No match >= 70
PRDf0e016fd,Mallows Beauty Hyaluronic Acid Serum,BRD164fede5,Mallows Beauty,CAT722a51fb,Face Serum,,,7.67,GBP,20251108_121214,Justmylook,mallows beauty hyaluronic acid serum,mallows beauty,face serum,justmylook,No match >= 70
PRDad7785eb,Skin Design London Retexturising Serum,BRD22267c1f,Skin Design,CAT722a51fb,Face Serum,30.0,ml,150.0,GBP,20251108_121231,Skin Design London,skin design london retexturising serum,skin design,face serum,skin design london,No match >= 70
PRD61f260f0,"Facial Serum 10% Hyaluronic Acidanti-Wrinkle,Antipigmentation Face Serum For Men & Women Repairing Fine Lines, Wrinkles And Dryness Of The Skin",BRD5e6546ae,Facial Serum,CAT722a51fb,Face Serum,,,5.99,GBP,20251108_121231,Amazon.co.uk - Amazon.co.uk-Seller,facial serum 10 hyaluronic acidanti wrinkle antipigmentation face serum for men women repairing fine lines wrinkles and dryness of the skin,facial serum,face serum,amazon co uk amazon co uk seller,No match >= 70
PRDadf1d9bd,Cult51 Immediate Effects Serum for Unisex,BRDe98e3c97,Cult51 Immediate,CAT722a51fb,Face Serum,1.05,oz,81.97,GBP,20251108_121231,Amazon.co.uk,cult51 immediate effects serum for unisex,cult51 immediate,face serum,amazon co uk,No match >= 70
PRD605b9aa4,Skin Food Glow Serum Drops,BRD76aa45d0,Skin Food,CAT722a51fb,Face Serum,30.0,ml,12.95,GBP,20251108_121231,Weleda,skin food glow serum drops,skin food,face serum,weleda,No match >= 70
PRDd1ca1607,Balance Active Formula Niacinamide Blemish Recovery Serum,BRD39a3f437,Balance Active,CAT722a51fb,Face Serum,,,24.99,GBP,20251108_121231,Amazon.co.uk - Amazon.co.uk-Seller,balance active formula niacinamide blemish recovery serum,balance active,face serum,amazon co uk amazon co uk seller,No match >= 70
PRDdda5fe40,Arencia Holy Hyssop Serum 12,BRDdc88e1db,Arencia Holy,CAT722a51fb,Face Serum,,,25.48,GBP,20251108_121231,Amazon.co.uk - Amazon.co.uk-Seller,arencia holy hyssop serum 12,arencia holy,face serum,amazon co uk amazon co uk seller,No match >= 70
PRDc34acd14,Ac+R Youthful Glow Serum Concentrate,BRD6972d5af,Ac+R Youthful,CAT722a51fb,Face Serum,,,52.0,GBP,20251108_121231,Cult Beauty,ac r youthful glow serum concentrate,ac r youthful,face serum,cult beauty,No match >= 70
PRD310ca00b,Barber Pro Hydrating Face Serum,BRD656d5c43,Barber Pro,CAT722a51fb,Face Serum,,,10.0,GBP,20251108_121231,barberpro.com,barber pro hydrating face serum,barber pro,face serum,barberpro com,No match >= 70
PRD591b82f4,Bio Balance Super Serum,BRD681daf1c,Bio Balance,CAT722a51fb,Face Serum,,,14.59,GBP,20251108_121231,Amazon.co.uk - Amazon.co.uk-Seller,bio balance super serum,bio balance,face serum,amazon co uk amazon co uk seller,No match >= 70
PRD0ec42841,Pestle and Mortar 2 Phase Serum,BRDbf1c947b,Pestle,CAT722a51fb,Face Serum,,,74.0,GBP,20251108_121231,Amazon.co.uk - Amazon.co.uk-Seller,pestle and mortar 2 phase serum,pestle,face serum,amazon co uk amazon co uk seller,No match >= 70
PRDbc98515a,AA Laab Concentrated Face Serum,BRD3adfcd2a,AA Laab,CAT722a51fb,Face Serum,,,9.0,GBP,20251108_121231,Ezebra.co.uk,aa laab concentrated face serum,aa laab,face serum,ezebra co uk,No match >= 70
PRD6f5f21f8,Weleda Hyaluronic Moisture Serum Drops,BRD0466d559,Weleda Hyaluronic,CAT722a51fb,Face Serum,,,10.36,GBP,20251108_121231,Holland & Barrett,weleda hyaluronic moisture serum drops,weleda hyaluronic,face serum,holland barrett,No match >= 70
PRDe74180c3,Brightening Serum,BRD62eb295b,Brightening Serum,CAT722a51fb,Face Serum,,,90.0,GBP,20251108_121231,Shavata Singh,brightening serum,brightening serum,face serum,shavata singh,No match >= 70
PRDcc1d2787,Anua Soothing Serum,BRD02cb47a0,Anua Soothing,CAT722a51fb,Face Serum,,,22.0,GBP,20251108_121231,Cult Beauty,anua soothing serum,anua soothing,face serum,cult beauty,No match >= 70
PRD57335c31,BingoSpa Active Face Serum,BRD58f46b08,BingoSpa Active,CAT722a51fb,Face Serum,,,16.4,GBP,20251108_121231,BINGOSPA,bingospa active face serum,bingospa active,face serum,bingospa,No match >= 70
PRDe8f610d1,Melvita Argan Bio Active Expert Smoothing & Radiance Serum,BRDa754dc23,Melvita Argan,CAT722a51fb,Face Serum,,,26.43,GBP,20251108_121231,Perfumes Club UK,melvita argan bio active expert smoothing radiance serum,melvita argan,face serum,perfumes club uk,No match >= 70
PRD41cd125b,Debenhams Hydrating Hyaluronic Serum,BRD8eaf6cdb,Debenhams Hydrating,CAT722a51fb,Face Serum,,,29.0,GBP,20251108_121231,Ella & Jo UK,debenhams hydrating hyaluronic serum,debenhams hydrating,face serum,ella jo uk,No match >= 70
PRD1202e996,Monday Muse The Juice Daily Serum,BRD65040949,Monday Muse,CAT722a51fb,Face Serum,,,39.95,GBP,20251108_121231,Monday Muse,monday muse the juice daily serum,monday muse,face serum,monday muse,No match >= 70
PRDcc0c35a3,SkinCeuticals A.G.E. Interrupter Ultra Serum,BRD043cc19d,SkinCeuticals A.G.E.,CAT722a51fb,Face Serum,,,120.0,GBP,20251108_121231,Skinstation,skinceuticals a g e interrupter ultra serum,skinceuticals a g e ,face serum,skinstation,No match >= 70
PRDccda25b5,Nineless A-Control 10% Azelaic Acid Serum,BRD3d5d2b75,Nineless A-Control,CAT722a51fb,Face Serum,,,11.66,GBP,20251108_121231,Justmylook,nineless a control 10 azelaic acid serum,nineless a control,face serum,justmylook,No match >= 70
PRDdc78a78e,Beauty of Joseon Revive Serum Mucin,BRD7a7f3a70,Beauty,CAT722a51fb,Face Serum,,,16.97,GBP,20251108_121231,Millies.ie,beauty of joseon revive serum mucin,beauty,face serum,millies ie,No match >= 70
PRD97fa8395,Muji Fermented Booster Serum Travel Size,BRD0b0a9e87,Muji Fermented,CAT722a51fb,Face Serum,50.0,ml,24.95,GBP,20251108_121231,MUJI,muji fermented booster serum travel size,muji fermented,face serum,muji,No match >= 70
PRDcbe1f570,e.l.f. Holy Hydration! Thirst Burst Drops,,,CAT722a51fb,Face Serum,,,13.0,GBP,20251108_121231,e.l.f. UK,e l f holy hydration thirst burst drops,,face serum,e l f uk,No match >= 70
PRDf97f8370,Beauty of Joseon Light On Serum,BRD7a7f3a70,Beauty,CAT722a51fb,Face Serum,,,14.39,GBP,20251108_121231,Superdrug.com,beauty of joseon light on serum,beauty,face serum,superdrug com,No match >= 70
PRDf6fe0f22,Rhug Wild Beauty Active Treatment Serum With Hyaluronic Acid,BRD7157e7b1,Rhug Wild,CAT722a51fb,Face Serum,,,130.0,GBP,20251108_121231,Rhug Wild Beauty,rhug wild beauty active treatment serum with hyaluronic acid,rhug wild,face serum,rhug wild beauty,No match >= 70
PRDf8e52f94,Nature's Journey Hydrating Face Serum,BRDf2b1303f,Nature's Journey,CAT722a51fb,Face Serum,,,10.0,GBP,20251108_121231,Beauty and the Benefit,nature s journey hydrating face serum,nature s journey,face serum,beauty and the benefit,No match >= 70
PRDf97646d2,Good Molecules Discoloration Correcting Serum,BRD4915386c,Good Molecules,CAT722a51fb,Face Serum,,,8.91,GBP,20251108_121231,Good Molecules,good molecules discoloration correcting serum,good molecules,face serum,good molecules,No match >= 70
PRD087bba94,Glow Recipe Avocado Ceramide Recovery Serum,BRDbb3870c2,Glow Recipe,CAT722a51fb,Face Serum,,,41.0,GBP,20251108_121231,Cult Beauty,glow recipe avocado ceramide recovery serum,glow recipe,face serum,cult beauty,No match >= 70
PRD85c315e8,Boost Lab 2D-Hyaluronic Hydro Boost Serum,BRD15593ac2,Boost Lab,CAT722a51fb,Face Serum,,,10.28,GBP,20251108_121245,Boost Lab,boost lab 2d hyaluronic hydro boost serum,boost lab,face serum,boost lab,No match >= 70
PRDd339a2c5,VT PDRN Essence 100,BRD4cbf948e,VT PDRN,CAT722a51fb,Face Serum,,,22.0,GBP,20251108_121245,Amazon.co.uk - Amazon.co.uk-Seller,vt pdrn essence 100,vt pdrn,face serum,amazon co uk amazon co uk seller,No match >= 70
PRDbca4b95b,Cell Rejuvenating Power Serum,BRD1822f4c6,Cell Rejuvenating,CAT722a51fb,Face Serum,,,195.0,GBP,20251108_121245,Victoria Beckham Beauty,cell rejuvenating power serum,cell rejuvenating,face serum,victoria beckham beauty,No match >= 70
PRD58f7428b,Nine Less B-Boost Korean Skincare Serum,BRD157657d7,Nine Less,CAT722a51fb,Face Serum,,,11.66,GBP,20251108_121245,Justmylook,nine less b boost korean skincare serum,nine less,face serum,justmylook,No match >= 70
PRD47c8266f,RANAVAT Brightening Saffron Serum,BRD27898ca7,RANAVAT Brightening,CAT722a51fb,Face Serum,,,35.0,GBP,20251108_121245,Space NK,ranavat brightening saffron serum,ranavat brightening,face serum,space nk,No match >= 70
PRD78560333,Art Naturals Hyaluronic Acid Serum,BRD89ac496f,Art Naturals,CAT722a51fb,Face Serum,,,8.41,GBP,20251108_121245,iHerb,art naturals hyaluronic acid serum,art naturals,face serum,iherb,No match >= 70
PRD05f3959d,Geek & Gorgeous 101 HA 5 Rich Serum,BRD13f3648e,Geek,CAT722a51fb,Face Serum,,,8.99,GBP,20251108_121245,Superdrug.com,geek gorgeous 101 ha 5 rich serum,geek,face serum,superdrug com,No match >= 70
PRDef5fef33,Jeanne Piaubert Anti-Ageing Serum,BRDe310b72c,Jeanne Piaubert,CAT722a51fb,Face Serum,,,59.3,GBP,20251108_121245,Perfumes Club UK,jeanne piaubert anti ageing serum,jeanne piaubert,face serum,perfumes club uk,No match >= 70
PRDf67e5dce,Mancave Hyaluronic Face Serum,BRD541605d5,Mancave Hyaluronic,CAT722a51fb,Face Serum,50.0,ml,12.5,GBP,20251108_121245,Holland & Barrett,mancave hyaluronic face serum,mancave hyaluronic,face serum,holland barrett,No match >= 70
PRDb9a2d8b5,La Rosée Plumping Face Serum,BRDc6dc435f,La Rosée,CAT722a51fb,Face Serum,30.0,ml,18.3,GBP,20251108_121245,Cocooncenter.co.uk,la ros e plumping face serum,la ros e,face serum,cocooncenter co uk,No match >= 70
PRDa3135b83,Boost Lab Brightening Serum,BRD15593ac2,Boost Lab,CAT722a51fb,Face Serum,,,10.28,GBP,20251108_121245,Boost Lab,boost lab brightening serum,boost lab,face serum,boost lab,No match >= 70
PRDe4a46626,The Ordinary Niacinamide 10% + Zinc 1% Face Serum,BRDb60306d4,The Ordinary,CAT722a51fb,Face Serum,30.0,ml,43.92,GBP,20251108_121245,eBay - gharisi,the ordinary niacinamide 10 zinc 1 face serum,the ordinary,face serum,ebay gharisi,No match >= 70
PRD6500d4ff,Grown Alchemist Age-Repair Serum,BRD4c712be3,Grown Alchemist,CAT722a51fb,Face Serum,,,33.5,GBP,20251108_121245,eBay - aquamarine3d,grown alchemist age repair serum,grown alchemist,face serum,ebay aquamarine3d,No match >= 70
PRD0dd83dae,Organic Renew Facial Serum,BRDc6f0508c,Organic Renew,CAT722a51fb,Face Serum,,,14.85,GBP,20251108_121245,Kuumba Made,organic renew facial serum,organic renew,face serum,kuumba made,No match >= 70
PRD1ba78b0f,Warda Skin Hydration Boost Gel Serum,BRD994f7e1d,Warda Skin,CAT722a51fb,Face Serum,,,19.99,GBP,20251108_121245,Superdrug.com,warda skin hydration boost gel serum,warda skin,face serum,superdrug com,No match >= 70
PRDff85511b,Sanctuary Spa Signature Collection Body Butter,BRD81586a90,Sanctuary Spa,CAT73647004,Body Butter,,,3.5,GBP,20251108_121345,Amazon.co.uk,sanctuary spa signature collection body butter,sanctuary spa,body butter,amazon co uk,No match >= 70
PRDf4402683,Soap & Glory Body Butter The Righteous Butter,BRDc740969b,Soap,CAT73647004,Body Butter,,,7.49,GBP,20251108_121345,Boots.com,soap glory body butter the righteous butter,soap,body butter,boots com,No match >= 70
PRDe1b4ac16,Derma V10 Cocoa Body Butter,BRD090855c9,Derma V10,CAT73647004,Body Butter,,,1.49,GBP,20251108_121345,Wilko,derma v10 cocoa body butter,derma v10,body butter,wilko,No match >= 70
PRDdc82cf00,Naturium The Glow Getter Multi-Oil Body Butter,BRDbbf5ddd4,Naturium The,CAT73647004,Body Butter,,,22.0,GBP,20251108_121345,Amazon.co.uk,naturium the glow getter multi oil body butter,naturium the,body butter,amazon co uk,No match >= 70
PRD29f1eee1,NEOM Perfect Night's Sleep Magnesium Body Butter,BRDdcd45594,NEOM Perfect,CAT73647004,Body Butter,,,31.2,GBP,20251108_121345,John Lewis & Partners,neom perfect night s sleep magnesium body butter,neom perfect,body butter,john lewis partners,No match >= 70
PRDbb356a4b,A Little Something Fine Florals Body Butter Trio,BRDd945db6c,A Little,CAT73647004,Body Butter,,,6.0,GBP,20251108_121345,Boots.com,a little something fine florals body butter trio,a little,body butter,boots com,No match >= 70
PRD8ed88d88,Derma V10 Body Butter Coconut,BRD090855c9,Derma V10,CAT73647004,Body Butter,220.0,ml,3.99,GBP,20251108_121345,Amazon.co.uk - Amazon.co.uk-Seller,derma v10 body butter coconut,derma v10,body butter,amazon co uk amazon co uk seller,No match >= 70
PRDfd79310d,Argan Oil Body Butter,BRDdb3f32fe,Argan Oil,CAT73647004,Body Butter,250.0,ml,1.0,GBP,20251108_121345,Wilko,argan oil body butter,argan oil,body butter,wilko,No match >= 70
PRDc04de7e2,Treaclemoon Brazilian Love Body Butter,BRDceb99f61,Treaclemoon Brazilian,CAT73647004,Body Butter,,,5.0,GBP,20251108_121345,Tesco,treaclemoon brazilian love body butter,treaclemoon brazilian,body butter,tesco,No match >= 70
PRD67541c15,Tree Hut Watermelon Whipped Body Butter,BRD73adf0a2,Tree Hut,CAT73647004,Body Butter,,,11.99,GBP,20251108_121345,Boots.com,tree hut watermelon whipped body butter,tree hut,body butter,boots com,No match >= 70
PRD27b7a18a,Lemon Berry Barn Coconut Calm Body Butter,BRD87c913e6,Lemon Berry,CAT73647004,Body Butter,200.0,ml,2.5,GBP,20251108_121345,Tesco,lemon berry barn coconut calm body butter,lemon berry,body butter,tesco,No match >= 70
PRD9046cb21,Dr Organic Aloe Vera Body Butter,BRDf78117d6,Dr Organic,CAT73647004,Body Butter,,,11.99,GBP,20251108_121345,Holland & Barrett,dr organic aloe vera body butter,dr organic,body butter,holland barrett,No match >= 70
PRDb3c00755,The White Company Seychelles Body Butter,BRD58f340fd,The White,CAT73647004,Body Butter,200.0,ml,16.0,GBP,20251108_121345,LOOKFANTASTIC,the white company seychelles body butter,the white,body butter,lookfantastic,No match >= 70
PRD2ce40b46,Garnier Body Superfood Repairing Body Butter Cocoa,BRD162d58fc,Garnier,CAT73647004,Body Butter,,,4.99,GBP,20251108_121345,Wilko,garnier body superfood repairing body butter cocoa,garnier,body butter,wilko,No match >= 70
PRD15ab61d2,Q+A Collagen Body Butter,BRD870edef2,Q+A Collagen,CAT73647004,Body Butter,,,10.0,GBP,20251108_121345,Q+A,q a collagen body butter,q a collagen,body butter,q a,No match >= 70
PRD29b9e0c1,Soap Glory Smoothie Star Body Butter,BRD7c966323,Soap Glory,CAT73647004,Body Butter,300.0,ml,7.49,GBP,20251108_121345,Boots.com,soap glory smoothie star body butter,soap glory,body butter,boots com,No match >= 70
PRD7e3f0285,Feather & Down Magnesium & Passionflower Dreamy Sleep Cloud Body Butter,BRD5000a68e,Feather,CAT73647004,Body Butter,,,12.0,GBP,20251108_121345,Feather and Down,feather down magnesium passionflower dreamy sleep cloud body butter,feather,body butter,feather and down,No match >= 70
PRDf2b13eb3,I Love Coconut & Cream Body Butter,BRDc950d024,I Love,CAT73647004,Body Butter,,,2.49,GBP,20251108_121345,Wilko,i love coconut cream body butter,i love,body butter,wilko,No match >= 70
PRDff6edfe4,Neal's Yard Remedies Aromatic Body Butter,BRD78d7a07c,Neal's Yard,CAT73647004,Body Butter,,,24.0,GBP,20251108_121345,Waitrose & Partners,neal s yard remedies aromatic body butter,neal s yard,body butter,waitrose partners,No match >= 70
PRDaadde9dc,Treaclemoon Our Glorious Body Butters,BRDe9a8de1b,Treaclemoon Our,CAT73647004,Body Butter,,,6.56,GBP,20251108_121345,Notino.co.uk,treaclemoon our glorious body butters,treaclemoon our,body butter,notino co uk,No match >= 70
PRDab6f59b8,Palmer's Cocoa Butter Formula,BRDca76801e,Palmer's Cocoa,CAT73647004,Body Butter,,,4.3,GBP,20251108_121345,Tesco,palmer s cocoa butter formula,palmer s cocoa,body butter,tesco,No match >= 70
PRDad80f5ee,Soap & Glory Limited Edition Body Butter Cherry Wild,BRDc740969b,Soap,CAT73647004,Body Butter,200.0,ml,5.99,GBP,20251108_121345,Boots.com,soap glory limited edition body butter cherry wild,soap,body butter,boots com,No match >= 70
PRD78142e75,Sanctuary Spa Signature Natural Oils Melting Pearl Body Butter,BRD81586a90,Sanctuary Spa,CAT73647004,Body Butter,300.0,ml,16.0,GBP,20251108_121345,Ocado,sanctuary spa signature natural oils melting pearl body butter,sanctuary spa,body butter,ocado,No match >= 70
PRD6514d043,Skin Saints Body Butter Sweet Flowers,BRD17ae79e6,Skin Saints,CAT73647004,Body Butter,200.0,ml,4.5,GBP,20251108_121345,Tesco,skin saints body butter sweet flowers,skin saints,body butter,tesco,No match >= 70
PRD4452b39d,nalas baby Body Butter Duo,,,CAT73647004,Body Butter,200.0,ml,14.0,GBP,20251108_121345,Boots.com,nalas baby body butter duo,,body butter,boots com,No match >= 70
PRD305bce14,Fushi Organic Shea Butter Original,BRD8865f1a0,Fushi Organic,CAT73647004,Body Butter,200.0,g,15.0,GBP,20251108_121345,Fushi Wellbeing,fushi organic shea butter original,fushi organic,body butter,fushi wellbeing,No match >= 70
PRD256f16bd,Caudalie Vinotherapist Replenishing Vegan Body Butter,BRDc67ece2e,Caudalie Vinotherapist,CAT73647004,Body Butter,,,26.0,GBP,20251108_121345,Caudalie UK,caudalie vinotherapist replenishing vegan body butter,caudalie vinotherapist,body butter,caudalie uk,No match >= 70
PRD699dc9c0,This Works Perfect Legs Body Butter,BRD9c7bffd7,This Works,CAT73647004,Body Butter,,,29.0,GBP,20251108_121345,ThisWorks.com,this works perfect legs body butter,this works,body butter,thisworks com,No match >= 70
PRD47ea1152,Soap & Glory Berry & Bright Body Butter,BRDc740969b,Soap,CAT73647004,Body Butter,200.0,ml,6.0,GBP,20251108_121345,Boots.com,soap glory berry bright body butter,soap,body butter,boots com,No match >= 70
PRD7053c485,Whipped Mango Body Butter,BRDb8d1eacb,Whipped Mango,CAT73647004,Body Butter,,,15.0,GBP,20251108_121345,Lily M Beauty,whipped mango body butter,whipped mango,body butter,lily m beauty,No match >= 70
PRD2175b7ba,Clinique Deep Comfort Body Butter,BRDc246fead,Clinique Deep,CAT73647004,Body Butter,,,39.0,GBP,20251108_121345,Clinique,clinique deep comfort body butter,clinique deep,body butter,clinique,No match >= 70
PRD913efd69,Sanctuary Spa Lily & Rose Body Butter,BRD81586a90,Sanctuary Spa,CAT73647004,Body Butter,,,13.0,GBP,20251108_121345,Boots.com,sanctuary spa lily rose body butter,sanctuary spa,body butter,boots com,No match >= 70
PRDff02931a,No7 Beautiful Skin Intensive Body Butter,BRDb2225ed7,No7 Beautiful,CAT73647004,Body Butter,,,11.96,GBP,20251108_121345,Boots.com,no7 beautiful skin intensive body butter,no7 beautiful,body butter,boots com,No match >= 70
PRDe4842ed8,Soap & Glory Original The Righteous Butter Body Lotion,BRDc740969b,Soap,CAT73647004,Body Butter,,,3.66,GBP,20251108_121345,eBay,soap glory original the righteous butter body lotion,soap,body butter,ebay,No match >= 70
PRD3b80ff3c,Sol De Janeiro Brazilian Bum Bum Cream,BRDcc92cd4f,Sol De,CAT73647004,Body Butter,,,21.0,GBP,20251108_121345,Boots.com,sol de janeiro brazilian bum bum cream,sol de,body butter,boots com,No match >= 70
PRD07b14a1b,Palmer's Cocoa Butter Formula Body Lotion,BRDca76801e,Palmer's Cocoa,CAT73647004,Body Butter,,,6.0,GBP,20251108_121345,Tesco,palmer s cocoa butter formula body lotion,palmer s cocoa,body butter,tesco,No match >= 70
PRD7afe8a16,Tree Hut Coco Colada Whipped Body Butter,BRD73adf0a2,Tree Hut,CAT73647004,Body Butter,,,11.99,GBP,20251108_121345,Boots.com,tree hut coco colada whipped body butter,tree hut,body butter,boots com,No match >= 70
PRD6f41c8ba,NCLA Beauty Hi Butter Coconut Vanilla Body Butter,BRD27b5b1cb,NCLA Beauty,CAT73647004,Body Butter,,,28.0,GBP,20251108_121345,Boots.com,ncla beauty hi butter coconut vanilla body butter,ncla beauty,body butter,boots com,No match >= 70
PRD321459be,Garnier Body Superfood Nutri Glow Body Cream Vitamin C Mango,BRD162d58fc,Garnier,CAT73647004,Body Butter,,,4.99,GBP,20251108_121345,Wilko,garnier body superfood nutri glow body cream vitamin c mango,garnier,body butter,wilko,No match >= 70
PRDdb0df171,Oyoma Beauty Whipped Shea Butter,BRDc28fa02e,Oyoma Beauty,CAT73647004,Body Butter,,,24.0,GBP,20251108_121407,Superdrug.com,oyoma beauty whipped shea butter,oyoma beauty,body butter,superdrug com,No match >= 70
PRDa783e838,Soap & Glory Limited Edition Fresh As Fig Body Butter,BRDc740969b,Soap,CAT73647004,Body Butter,,,5.99,GBP,20251108_121407,Boots.com,soap glory limited edition fresh as fig body butter,soap,body butter,boots com,No match >= 70
PRD8487deca,The Body Shop British Rose Body Butter,BRD255ab7ee,The Body,CAT73647004,Body Butter,,,4.99,GBP,20251108_121407,Perfumes Club UK,the body shop british rose body butter,the body,body butter,perfumes club uk,No match >= 70
PRDfa6f41b0,Cocoa Body Butter,BRD25927391,Cocoa Body,CAT73647004,Body Butter,,,21.99,GBP,20251108_121407,Amazon.co.uk - Amazon.co.uk-Seller,cocoa body butter,cocoa body,body butter,amazon co uk amazon co uk seller,No match >= 70
PRDe3037209,Luxplus Argan Oil Body Butter,BRD58e0bf35,Luxplus Argan,CAT73647004,Body Butter,,,4.25,GBP,20251108_121407,Superdrug.com,luxplus argan oil body butter,luxplus argan,body butter,superdrug com,No match >= 70
PRD8fe440bd,Tree Hut Tropic Glow Whipped Body Butter,BRD73adf0a2,Tree Hut,CAT73647004,Body Butter,,,11.99,GBP,20251108_121407,Boots.com,tree hut tropic glow whipped body butter,tree hut,body butter,boots com,No match >= 70
PRD7f3cd250,Glow Body Butter Honey Coconut,BRD6917a30b,Glow Body,CAT73647004,Body Butter,250.0,ml,2.99,GBP,20251108_121407,Home Bargains,glow body butter honey coconut,glow body,body butter,home bargains,No match >= 70
PRD4a89a3ef,Tree Hut Moroccan Rose Whipped Body Butter,BRD73adf0a2,Tree Hut,CAT73647004,Body Butter,,,15.99,GBP,20251108_121439,Boots.com,tree hut moroccan rose whipped body butter,tree hut,body butter,boots com,No match >= 70
PRD966dcd32,debenhams Hi Butter Pink Champagne Body Butter,,,CAT73647004,Body Butter,,,28.0,GBP,20251108_121407,Boots.com,debenhams hi butter pink champagne body butter,,body butter,boots com,No match >= 70
PRD88f67225,Organic Shop Nurturing Body Cream Blueberry & Blackberry,BRD47539b2f,Organic Shop,CAT73647004,Body Butter,250.0,ml,2.25,GBP,20251108_121407,Superdrug.com,organic shop nurturing body cream blueberry blackberry,organic shop,body butter,superdrug com,No match >= 70
PRD7442b986,OUAI St Barts Body,BRD6eb93a6c,OUAI St,CAT73647004,Body Butter,,,31.7,GBP,20251108_121407,Amazon.co.uk - Amazon.co.uk-Seller,ouai st barts body,ouai st,body butter,amazon co uk amazon co uk seller,No match >= 70
PRD92c4d6da,Coconut & Mint Body Butter,BRD540e009b,Coconut,CAT73647004,Body Butter,,,4.99,GBP,20251108_121407,TK Maxx,coconut mint body butter,Generic,body butter,tk maxx,No match >= 70
PRD30a3b49a,Soap & Glory MAGNIFI-COCO Body Butter,BRDc740969b,Soap,CAT73647004,Body Butter,,,7.49,GBP,20251108_121407,Boots.com,soap glory magnifi coco body butter,soap,body butter,boots com,No match >= 70
PRD888f8003,Kutis Naked Unscented Body Butter,BRD181201d3,Kutis Naked,CAT73647004,Body Butter,,,8.0,GBP,20251108_121407,The Eco Boutique,kutis naked unscented body butter,kutis naked,body butter,the eco boutique,No match >= 70
PRD8730dbc2,The Body Shop Mango Body Butter,BRD255ab7ee,The Body,CAT73647004,Body Butter,,,4.07,GBP,20251108_121407,Perfumes Club UK,the body shop mango body butter,the body,body butter,perfumes club uk,No match >= 70
PRDa470942d,Champneys Citrus Blush Enlivening Body Butter,BRD43e7c129,Champneys Citrus,CAT73647004,Body Butter,,,14.88,GBP,20251108_121407,Amazon.co.uk - Amazon.co.uk-Seller,champneys citrus blush enlivening body butter,champneys citrus,body butter,amazon co uk amazon co uk seller,No match >= 70
PRD9f935292,Sanctuary Spa Golden Sandalwood Melting Body Butter,BRD81586a90,Sanctuary Spa,CAT73647004,Body Butter,,,15.99,GBP,20251108_121407,Superdrug.com,sanctuary spa golden sandalwood melting body butter,sanctuary spa,body butter,superdrug com,No match >= 70
PRD56d1728e,Diptyque Rich Butter For The Body,BRD7a165eb5,Diptyque Rich,CAT73647004,Body Butter,200.0,ml,64.0,GBP,20251108_121407,diptyque UK,diptyque rich butter for the body,diptyque rich,body butter,diptyque uk,No match >= 70
PRDaab68ee9,So...? Sorry Not Sorry Spread The Love Body Butter,BRDe8b23cdc,So...? Sorry,CAT73647004,Body Butter,,,3.0,GBP,20251108_121407,So Fragrance,so sorry not sorry spread the love body butter,so sorry,body butter,so fragrance,No match >= 70
PRD7d4c7911,Burst Bodycare Aloe Body Butter,BRDc8b94e77,Burst Bodycare,CAT73647004,Body Butter,,,8.0,GBP,20251108_121407,M&S,burst bodycare aloe body butter,burst bodycare,body butter,m s,No match >= 70
PRD15dceb73,Mad Beauty Gilmore Girls Body Butter,BRD7843ef96,Mad Beauty,CAT73647004,Body Butter,,,9.99,GBP,20251108_121407,Truffle Shuffle,mad beauty gilmore girls body butter,mad beauty,body butter,truffle shuffle,No match >= 70
PRD4625a9ee,Farmona Tutti Frutti Nourishing Body Butter Caramel & Cinnamon,BRD4535d2fc,Farmona Tutti,CAT73647004,Body Butter,200.0,ml,3.6,GBP,20251108_121407,Notino.co.uk,farmona tutti frutti nourishing body butter caramel cinnamon,farmona tutti,body butter,notino co uk,No match >= 70
PRD6ef143ea,Apothecary Women's Calm Body Butter,BRDea6b56e8,Apothecary Women's,CAT73647004,Body Butter,,,8.5,GBP,20251108_121407,M&S,apothecary women s calm body butter,apothecary women s,body butter,m s,No match >= 70
