product_id,product_name,brand_id,brand_name,category_id,category_name,size_value,size_unit,price,currency,date_collected,retailer_name,product_clean,brand_clean,category_clean,retailer_clean,reason_unmatched
PRDab4a7afe,Petal Power Bloom in Soap Hair Conditioner Bars,BRD2094fd7f,Petal Power,CAT5a93da1d,Conditioner Bar,,,9.99,GBP,20251108_120901,Bloom In Soap,petal power bloom in soap hair conditioner bars,petal power,conditioner bar,bloom in soap,No match >= 70
PRD2c4133ca,alott - nourishing conditioner bar,,,CAT5a93da1d,Conditioner Bar,,,16.0,GBP,20251108_120901,Jjungl,alott nourishing conditioner bar,,conditioner bar,jjungl,No match >= 70
PRDca4b0565,alott - nourishing conditioner bar | Glow Organic,,,CAT5a93da1d,Conditioner Bar,,,16.0,GBP,20251108_120901,Glow Organic,alott nourishing conditioner bar glow organic,,conditioner bar,glow organic,No match >= 70
PRD5c42e109,Coconut Conditioner Bar,BRD47b72585,Coconut Conditioner,CAT5a93da1d,Conditioner Bar,,,5.25,GBP,20251108_120901,Superfly Soap,coconut conditioner bar,coconut conditioner,conditioner bar,superfly soap,No match >= 70
PRD0e1b0d18,Unscented Conditioner Solid Bar,BRD30b7c72e,Unscented Conditioner,CAT5a93da1d,Conditioner Bar,,,4.0,GBP,20251108_120901,Megan and Willow,unscented conditioner solid bar,unscented conditioner,conditioner bar,megan and willow,No match >= 70
PRDaf820af2,Delicate Flower Fragrance Free Conditioner Bars,BRD7e4e8bd9,Delicate Flower,CAT5a93da1d,Conditioner Bar,,,11.99,GBP,20251108_120901,Bloom In Soap,delicate flower fragrance free conditioner bars,delicate flower,conditioner bar,bloom in soap,No match >= 70
PRD6890dbd7,Herbal Boost Bloom in Soap Hair Conditioner Bars,BRD098f02fb,Herbal Boost,CAT5a93da1d,Conditioner Bar,,,9.99,GBP,20251108_120901,Bloom In Soap,herbal boost bloom in soap hair conditioner bars,herbal boost,conditioner bar,bloom in soap,No match >= 70
PRD898379d1,Natural Conditioner Bar with Pink Clay & Grapefruit,BRD97c669a9,Natural Conditioner,CAT5a93da1d,Conditioner Bar,,,8.0,GBP,20251108_120901,Wriggly Tin Soap Co.,natural conditioner bar with pink clay grapefruit,natural conditioner,conditioner bar,wriggly tin soap co ,No match >= 70
PRD156f3f05,Solid Naked Fragrance Free Buy Shampoo & Conditioner Bar,BRD94021d12,Solid Naked,CAT5a93da1d,Conditioner Bar,,,17.0,GBP,20251108_120901,Buddha & Bubbles Soap Co,solid naked fragrance free buy shampoo conditioner bar,solid naked,conditioner bar,buddha bubbles soap co,No match >= 70
PRDee0124b8,Lemongrass Solid Conditioner Bar,BRD9cbb0bd4,Lemongrass Solid,CAT5a93da1d,Conditioner Bar,,,5.25,GBP,20251108_120901,Superfly Soap,lemongrass solid conditioner bar,lemongrass solid,conditioner bar,superfly soap,No match >= 70
PRD6716649e,Jack59 Restore Solid Conditioner Bar,BRD916473f6,Jack59 Restore,CAT5a93da1d,Conditioner Bar,,,25.97,GBP,20251108_120901,Snapklik.com,jack59 restore solid conditioner bar,jack59 restore,conditioner bar,snapklik com,No match >= 70
PRDf28d9a04,Naturally Gorgeous Cosmetics Fruit Tea Conditioner Bar,BRD4761a734,Naturally Gorgeous,CAT5a93da1d,Conditioner Bar,,,5.98,GBP,20251108_120901,Clearstone,naturally gorgeous cosmetics fruit tea conditioner bar,naturally gorgeous,conditioner bar,clearstone,No match >= 70
PRD47cdc87a,Fragrance-Free Solid Conditioner Bar,BRD202cba21,Fragrance-Free Solid,CAT5a93da1d,Conditioner Bar,,,7.55,GBP,20251108_120901,Superfly Soap,fragrance free solid conditioner bar,fragrance free solid,conditioner bar,superfly soap,No match >= 70
PRD3c74a68f,Lavender and Rosemary Conditioner Bar,BRDe346c232,Lavender,CAT5a93da1d,Conditioner Bar,,,5.98,GBP,20251108_120901,Clearstone,lavender and rosemary conditioner bar,lavender,conditioner bar,clearstone,No match >= 70
PRDdcd026cb,Solid Fragrance Free Plain Compostable Biodegradable Conditioner Bar,BRDec545c08,Solid Fragrance,CAT5a93da1d,Conditioner Bar,,,9.0,GBP,20251108_120901,Buddha & Bubbles Soap Co,solid fragrance free plain compostable biodegradable conditioner bar,solid fragrance,conditioner bar,buddha bubbles soap co,No match >= 70
PRDd1a85495,Bella Conditioner Bar,BRDb54e50ce,Bella Conditioner,CAT5a93da1d,Conditioner Bar,,,4.0,GBP,20251108_120901,Diva Spa,bella conditioner bar,bella conditioner,conditioner bar,diva spa,No match >= 70
PRD4c4baf48,Mint Conditioner Bar,BRD3ff1e1d6,Mint Conditioner,CAT5a93da1d,Conditioner Bar,55.0,g,4.99,GBP,20251108_120901,BotaniVie,mint conditioner bar,mint conditioner,conditioner bar,botanivie,No match >= 70
PRD7f4e36a6,ethique Brightening Conditioner Bar for Brassy Hair Uses,,,CAT5a93da1d,Conditioner Bar,,,5.0,GBP,20251108_120901,Ethique GB,ethique brightening conditioner bar for brassy hair uses,,conditioner bar,ethique gb,No match >= 70
PRDe76a14df,Unscented Conditioner Bars,BRD30b7c72e,Unscented Conditioner,CAT5a93da1d,Conditioner Bar,,,10.0,GBP,20251108_120901,Pentland Aromatics,unscented conditioner bars,unscented conditioner,conditioner bar,pentland aromatics,No match >= 70
PRD6c2b5f90,Ethique Guardian Conditioner Bar for Normal-Dry Hair-Mini,BRD73496aa3,Ethique Guardian,CAT5a93da1d,Conditioner Bar,,,3.5,GBP,20251108_120901,New Zealand Nature - UK,ethique guardian conditioner bar for normal dry hair mini,ethique guardian,conditioner bar,new zealand nature uk,No match >= 70
PRD5070afed,Mars Made Rosemary Conditioner Bar,BRD6c1c7451,Mars Made,CAT5a93da1d,Conditioner Bar,,,22.26,GBP,20251108_120901,Snapklik.com,mars made rosemary conditioner bar,mars made,conditioner bar,snapklik com,No match >= 70
PRD3d8a5bca,AVEO Professional Wonderful Love of Curls Solid Conditioner,BRD7a69cfb9,AVEO Professional,CAT5a93da1d,Conditioner Bar,70.0,g,2.52,GBP,20251108_120901,ohfeliz.co.uk,aveo professional wonderful love of curls solid conditioner,aveo professional,conditioner bar,ohfeliz co uk,No match >= 70
PRD98e3b410,Lemon Conditioner Bar For All Hair Types,BRDc3bf812d,Lemon Conditioner,CAT5a93da1d,Conditioner Bar,,,2.99,GBP,20251108_120901,Not On The High Street,lemon conditioner bar for all hair types,lemon conditioner,conditioner bar,not on the high street,No match >= 70
PRDd84b494d,New Patchouli and Geranium Conditioner Bars,BRD8050cf3c,New Patchouli,CAT5a93da1d,Conditioner Bar,,,10.0,GBP,20251108_120901,Pentland Aromatics,new patchouli and geranium conditioner bars,new patchouli,conditioner bar,pentland aromatics,No match >= 70
PRD7de6409b,Angelica Conditioner Bar,BRD732339bc,Angelica Conditioner,CAT5a93da1d,Conditioner Bar,,,4.0,GBP,20251108_120901,Diva Spa,angelica conditioner bar,angelica conditioner,conditioner bar,diva spa,No match >= 70
PRD99303b82,Conditioner Bar - - Lavender & Geranium | Friendly Soap,BRD6003a530,Friendly Soap,CAT5a93da1d,Conditioner Bar,12.0,pack,91.7,GBP,20251108_120901,Friendly Soap,conditioner bar lavender geranium friendly soap,friendly soap,conditioner bar,friendly soap,No match >= 70
PRDb66caff1,Bee Kind Natural Conditioner Bar,BRD813e6a9d,Bee Kind,CAT5a93da1d,Conditioner Bar,,,6.9,GBP,20251108_120901,Hippo Health,bee kind natural conditioner bar,bee kind,conditioner bar,hippo health,No match >= 70
PRD8f318b07,Vital Flow Conditioner Bar – Hydration and Definition for Curls and Dry Hair Hydrating | Curl Defining | Frizz Control,BRD544f8f9d,Vital Flow,CAT5a93da1d,Conditioner Bar,,,10.99,GBP,20251108_120901,Ita's Natural Essentials,vital flow conditioner bar hydration and definition for curls and dry hair hydrating curl defining frizz control,vital flow,conditioner bar,ita s natural essentials,No match >= 70
PRDfd9a5123,New Conditioner Bars Peppermint and Eucalyptus Shampoo and Conditioner Set,BRD367e61e8,New Conditioner,CAT5a93da1d,Conditioner Bar,,,18.0,GBP,20251108_120901,Pentland Aromatics,new conditioner bars peppermint and eucalyptus shampoo and conditioner set,new conditioner,conditioner bar,pentland aromatics,No match >= 70
PRD83c4c8b6,"Aloe Magnolia Solid Conditioner, 60",BRDbcd816bb,Aloe Magnolia,CAT5a93da1d,Conditioner Bar,,,39.59,GBP,20251108_120901,eBay - onebioshopcom,aloe magnolia solid conditioner 60,aloe magnolia,conditioner bar,ebay onebioshopcom,No match >= 70
PRD8e54123b,Conditioner Bar - - Peppermint & Eucalyptus | Friendly Soap,BRD6003a530,Friendly Soap,CAT5a93da1d,Conditioner Bar,12.0,pack,91.7,GBP,20251108_120901,Friendly Soap,conditioner bar peppermint eucalyptus friendly soap,friendly soap,conditioner bar,friendly soap,No match >= 70
PRD6bd12c00,Bare Necessities Love Is in The Hair Conditioner Bar,BRDaa4b3cad,Bare Necessities,CAT5a93da1d,Conditioner Bar,,,14.37,GBP,20251108_120901,Swadesi,bare necessities love is in the hair conditioner bar,bare necessities,conditioner bar,swadesi,No match >= 70
PRD5f0056df,Sweet & Sassy 3 Conditioner Bars,BRD0c13f53c,Sweet,CAT5a93da1d,Conditioner Bar,,,33.4,GBP,20251108_120901,Snapklik.com,sweet sassy 3 conditioner bars,sweet,conditioner bar,snapklik com,No match >= 70
PRD9ee620bb,Raw Roots Conditioner Bar,BRDa811f75f,Raw Roots,CAT5a93da1d,Conditioner Bar,,,17.14,GBP,20251108_120901,Mountain Dreads,raw roots conditioner bar,raw roots,conditioner bar,mountain dreads,No match >= 70
PRDc487b36d,Posy London Conditioner Bars and Solid Conditioners,BRD92c5b3de,Posy London,CAT5a93da1d,Conditioner Bar,,,8.0,GBP,20251108_120901,Posy London Natural Deodorant,posy london conditioner bars and solid conditioners,posy london,conditioner bar,posy london natural deodorant,No match >= 70
PRD5b7e9ec1,Shower Candy Moroccan Mint Solid Hair Conditioner Bar,BRD5a341d62,Shower Candy,CAT5a93da1d,Conditioner Bar,,,18.55,GBP,20251108_120901,Snapklik.com,shower candy moroccan mint solid hair conditioner bar,shower candy,conditioner bar,snapklik com,No match >= 70
PRD7c1cb8ab,Aspen Kay Naturals Conditioner Bar,BRD3c63b130,Aspen Kay,CAT5a93da1d,Conditioner Bar,,,25.97,GBP,20251108_120918,Snapklik.com,aspen kay naturals conditioner bar,aspen kay,conditioner bar,snapklik com,No match >= 70
PRD5cc056bd,Conditioner Bar for Hair Growth,BRD5a93da1d,Conditioner Bar,CAT5a93da1d,Conditioner Bar,,,22.26,GBP,20251108_120918,Snapklik.com,conditioner bar for hair growth,conditioner bar,conditioner bar,snapklik com,No match >= 70
PRDe4a75ca8,Hairy Jayne Solid Conditioner Bar,BRDe2176146,Hairy Jayne,CAT5a93da1d,Conditioner Bar,,,9.0,GBP,20251108_120918,Zero Store,hairy jayne solid conditioner bar,hairy jayne,conditioner bar,zero store,No match >= 70
PRDa6d024a6,"Lavender and Lime , Solid Conditioner, Zero Waste, Hair conditioner, Self Care, Eco, Vegan Products, Plastic Free, long lasting Travel bar",BRDe346c232,Lavender,CAT5a93da1d,Conditioner Bar,5.0,g,1.5,GBP,20251108_120918,The Natural Spa Cosmetics,lavender and lime solid conditioner zero waste hair conditioner self care eco vegan products plastic free long lasting travel bar,lavender,conditioner bar,the natural spa cosmetics,No match >= 70
PRD9b7d14a3,Bison Madoca Cow Conditioner Bar,BRD88ff55da,Bison Madoca,CAT5a93da1d,Conditioner Bar,,,19.14,GBP,20251108_120918,MiauMall,bison madoca cow conditioner bar,bison madoca,conditioner bar,miaumall,No match >= 70
PRDb007f6f2,CONDITIONER BAR SEAWEED - PURC CONDITIONER BAR SEAWEED VEGAN CONDITIONER,BRD9c9e2256,CONDITIONER BAR,CAT5a93da1d,Conditioner Bar,,,18.55,GBP,20251108_120918,pure-keratin.com,conditioner bar seaweed purc conditioner bar seaweed vegan conditioner,conditioner bar,conditioner bar,pure keratin com,No match >= 70
PRDaed0941e,Solid Conditioner Bar ~ Sweet & Fruity Scents,BRD2bed99ab,Solid Conditioner,CAT5a93da1d,Conditioner Bar,,,1.0,GBP,20251108_120918,nirvana.by.nichola,solid conditioner bar sweet fruity scents,solid conditioner,conditioner bar,nirvana by nichola,No match >= 70
PRDc3647fd8,CONDITIONER BAR LAVENDER - PURC CONDITIONER BAR LAVENDER CRUELTY FREE VEGAN CONDITIONER BAR,BRD9c9e2256,CONDITIONER BAR,CAT5a93da1d,Conditioner Bar,,,18.55,GBP,20251108_120918,pure-keratin.com,conditioner bar lavender purc conditioner bar lavender cruelty free vegan conditioner bar,conditioner bar,conditioner bar,pure keratin com,No match >= 70
PRDf8b4251b,"Ethique, The Guardian Solid Conditioner for Normal or Dry Hair",BRD74c8d545,"Ethique, The",CAT5a93da1d,Conditioner Bar,,,14.0,GBP,20251108_120918,Ethique GB,ethique the guardian solid conditioner for normal or dry hair,ethique the,conditioner bar,ethique gb,No match >= 70
PRD90e4196b,Lavender Tea Tree Conditioner Bar | Plastic-Free | UK,BRD9043156f,Lavender Tea,CAT5a93da1d,Conditioner Bar,,,8.99,GBP,20251108_120918,Zero Waste Supply Co.,lavender tea tree conditioner bar plastic free uk,lavender tea,conditioner bar,zero waste supply co ,No match >= 70
PRD954f0cea,Conditioner bar - The Green Turtle Unscented,BRD1c6763b0,Conditioner,CAT5a93da1d,Conditioner Bar,,,5.25,GBP,20251108_120918,The Green Turtle,conditioner bar the green turtle unscented,conditioner,conditioner bar,the green turtle,No match >= 70
PRD0965fae1,Curly & Dry Hair Conditioner Bar | Shea Butter & Olive Oil | Natural & Nourishing Solid Conditioner,BRDe63b3c8e,Curly,CAT5a93da1d,Conditioner Bar,,,7.5,GBP,20251108_120918,Riwaya,curly dry hair conditioner bar shea butter olive oil natural nourishing solid conditioner,curly,conditioner bar,riwaya,No match >= 70
PRD1f1b0352,"Coconut Conditioner Bar - Rich Nourishing & Volumizing - Hair Moisturizing & Strengthening Solid Soap Bar, Plastic-Free, Silicone & Sulfate Free",BRD47b72585,Coconut Conditioner,CAT5a93da1d,Conditioner Bar,,,18.55,GBP,20251108_120918,Snapklik.com,coconut conditioner bar rich nourishing volumizing hair moisturizing strengthening solid soap bar plastic free silicone sulfate free,coconut conditioner,conditioner bar,snapklik com,No match >= 70
PRD63a99245,Lemongrass Conditoning Bar,BRD9bce6824,Lemongrass Conditoning,CAT5a93da1d,Conditioner Bar,,,10.0,GBP,20251108_120918,OC Beauty,lemongrass conditoning bar,lemongrass conditoning,conditioner bar,oc beauty,No match >= 70
PRDe378fa9a,The Pink Muff Conditioner Bar,BRD1334cee6,The Pink,CAT5a93da1d,Conditioner Bar,,,9.95,GBP,20251108_120918,Not On The High Street,the pink muff conditioner bar,the pink,conditioner bar,not on the high street,No match >= 70
PRD4e147b1f,ECOAND Silky Vegan Conditioner Bar,BRD243dd400,ECOAND Silky,CAT5a93da1d,Conditioner Bar,,,22.26,GBP,20251108_120918,Snapklik.com,ecoand silky vegan conditioner bar,ecoand silky,conditioner bar,snapklik com,No match >= 70
PRDda91903c,StarBars Clarity Conditioner Bar,BRD0005c8c3,StarBars Clarity,CAT5a93da1d,Conditioner Bar,,,22.26,GBP,20251108_120918,Snapklik.com,starbars clarity conditioner bar,starbars clarity,conditioner bar,snapklik com,No match >= 70
PRDe84588de,Conditioner bar for oily hair - – Bain & Savon Ltd,BRD1c6763b0,Conditioner,CAT5a93da1d,Conditioner Bar,105.0,g,9.99,GBP,20251108_120918,Fab Discounts,conditioner bar for oily hair bain savon ltd,conditioner,conditioner bar,fab discounts,No match >= 70
PRDcd653116,Face Serum Wakame,BRD722a51fb,Face Serum,CAT722a51fb,Face Serum,20.0,ml,41.74,GBP,20251108_121214,Formula H Skincare,face serum wakame,face serum,face serum,formula h skincare,No match >= 70
PRD1d6375ad,Open Range Hair Conditioner Bar,BRD55c23942,Open Range,CAT5a93da1d,Conditioner Bar,,,6.24,GBP,20251108_120918,eBay,open range hair conditioner bar,open range,conditioner bar,ebay,No match >= 70
PRD85dafdb6,RAWROOTS.eu Conditioner Bar,BRD4870f09a,RAWROOTS.eu Conditioner,CAT5a93da1d,Conditioner Bar,,,13.88,GBP,20251108_120918,Raw Roots,rawroots eu conditioner bar,rawroots eu conditioner,conditioner bar,raw roots,No match >= 70
PRDa1005f77,Lemon Solid Conditioner - Hair & Bee Solid Conditioner Bar Conditioner bar in tin,BRD8ac1ed10,Lemon Solid,CAT5a93da1d,Conditioner Bar,,,6.99,GBP,20251108_120918,Bee Haven Bodycare & Gifts,lemon solid conditioner hair bee solid conditioner bar conditioner bar in tin,lemon solid,conditioner bar,bee haven bodycare gifts,No match >= 70
PRD9d7663dc,Jojoba & Argan Conditioner Bar,BRD026bae58,Jojoba,CAT5a93da1d,Conditioner Bar,,,10.65,GBP,20251108_120918,NatZen,jojoba argan conditioner bar,jojoba,conditioner bar,natzen,No match >= 70
PRDe9b597c0,Solid Conditioner Bar - Lavender,BRD2bed99ab,Solid Conditioner,CAT5a93da1d,Conditioner Bar,,,6.68,GBP,20251108_120918,eBay,solid conditioner bar lavender,solid conditioner,conditioner bar,ebay,No match >= 70
PRDb4008766,Abhati Suisse Anamudi Conditioner Bar,BRDb8aecded,Abhati Suisse,CAT5a93da1d,Conditioner Bar,60.0,g,17.74,GBP,20251108_120918,BeautyTheShop,abhati suisse anamudi conditioner bar,abhati suisse,conditioner bar,beautytheshop,No match >= 70
PRDe408fb7b,Coconut Curls Conditioning Shampoo Bar Trial Size,BRD422315c4,Coconut Curls,CAT5a93da1d,Conditioner Bar,,,5.49,GBP,20251108_120918,Bloom In Soap,coconut curls conditioning shampoo bar trial size,coconut curls,conditioner bar,bloom in soap,No match >= 70
PRD9dcb8ad0,Morava Conditioner Bar for Curly Hair,BRD30379272,Morava Conditioner,CAT5a93da1d,Conditioner Bar,,,18.55,GBP,20251108_120918,Snapklik.com,morava conditioner bar for curly hair,morava conditioner,conditioner bar,snapklik com,No match >= 70
PRDfc2db389,Natural Conditioning Bar,BRD2c3047ff,Natural Conditioning,CAT5a93da1d,Conditioner Bar,35.0,g,4.5,GBP,20251108_120918,Sinceris,natural conditioning bar,natural conditioning,conditioner bar,sinceris,No match >= 70
PRD6901606d,Limoux Cosmetics Solid Conditioner Bar,BRD199e8752,Limoux Cosmetics,CAT5a93da1d,Conditioner Bar,,,22.26,GBP,20251108_120918,Snapklik.com,limoux cosmetics solid conditioner bar,limoux cosmetics,conditioner bar,snapklik com,No match >= 70
PRD05589f51,Vida Bars Reyna Solid Conditioner Bar,BRD6e3d84cf,Vida Bars,CAT5a93da1d,Conditioner Bar,,,29.68,GBP,20251108_120918,Snapklik.com,vida bars reyna solid conditioner bar,vida bars,conditioner bar,snapklik com,No match >= 70
PRD6ac91761,Coconut Curls Conditioning Shampoo Bar,BRD422315c4,Coconut Curls,CAT5a93da1d,Conditioner Bar,,,11.99,GBP,20251108_120918,Bloom In Soap,coconut curls conditioning shampoo bar,coconut curls,conditioner bar,bloom in soap,No match >= 70
PRDf0eaaa00,BRIXY Balancing Shampoo and Conditioner Bar Set,BRDb7c8873e,BRIXY Balancing,CAT5a93da1d,Conditioner Bar,,,37.11,GBP,20251108_120918,Snapklik.com,brixy balancing shampoo and conditioner bar set,brixy balancing,conditioner bar,snapklik com,No match >= 70
PRDee369425,Donggubat Hair Conditioner Bar,BRDe870ef9b,Donggubat Hair,CAT5a93da1d,Conditioner Bar,100.0,g,8.69,GBP,20251108_120918,Olive Young Global,donggubat hair conditioner bar,donggubat hair,conditioner bar,olive young global,No match >= 70
PRD0c39eec6,The Earthling Co Conditioner Bars,BRDb27b7ec7,The Earthling,CAT5a93da1d,Conditioner Bar,,,48.24,GBP,20251108_120918,Snapklik.com,the earthling co conditioner bars,the earthling,conditioner bar,snapklik com,No match >= 70
PRD86f30984,janni bars Cú Chulainn Conditioner,,,CAT5a93da1d,Conditioner Bar,,,10.44,GBP,20251108_120918,Anniepooh,janni bars c chulainn conditioner,,conditioner bar,anniepooh,No match >= 70
PRD85e21985,Viori Terrace Garden Rice Water Conditioner Bar,BRDe21ccb1d,Viori Terrace,CAT5a93da1d,Conditioner Bar,,,16.0,GBP,20251108_120918,Ubuy,viori terrace garden rice water conditioner bar,viori terrace,conditioner bar,ubuy,No match >= 70
PRDceb86729,Natural Hair Conditioning Bar – Lemongrass,BRD64b88302,Natural Hair,CAT5a93da1d,Conditioner Bar,,,4.99,GBP,20251108_120918,Handmade Fever,natural hair conditioning bar lemongrass,natural hair,conditioner bar,handmade fever,No match >= 70
PRDca5f4122,Natural Hair Conditioning Bar – Lavender,BRD64b88302,Natural Hair,CAT5a93da1d,Conditioner Bar,,,4.99,GBP,20251108_120918,Handmade Fever,natural hair conditioning bar lavender,natural hair,conditioner bar,handmade fever,No match >= 70
PRDf4b0965c,CeraVe Resurfacing Retinol Serum,BRDcaf53d2a,CeraVe Resurfacing,CAT722a51fb,Face Serum,,,15.31,GBP,20251108_121026,Amazon.co.uk,cerave resurfacing retinol serum,cerave resurfacing,face serum,amazon co uk,No match >= 70
PRD1b1f0c45,Estee Lauder Advanced Night Repair Serum Synchronized Multi-Recovery Complex,BRD4a2d1f22,Estee Lauder,CAT722a51fb,Face Serum,,,52.0,GBP,20251108_121026,John Lewis & Partners,estee lauder advanced night repair serum synchronized multi recovery complex,estee lauder,face serum,john lewis partners,No match >= 70
PRD20def4c0,Simple Ceramide & Omega Complex Face Serum,BRD0980fcd5,Simple Ceramide,CAT722a51fb,Face Serum,,,6.65,GBP,20251108_121026,Amazon.co.uk,simple ceramide omega complex face serum,simple ceramide,face serum,amazon co uk,No match >= 70
PRDe128499b,Balance Active Formula Brightening Serum,BRD39a3f437,Balance Active,CAT722a51fb,Face Serum,,,2.99,GBP,20251108_121026,Home Bargains,balance active formula brightening serum,balance active,face serum,home bargains,No match >= 70
PRD13bb90a1,Garnier Brightening Serum,BRD162d58fc,Garnier,CAT722a51fb,Face Serum,,,9.33,GBP,20251108_121026,Boots.com,garnier brightening serum,garnier,face serum,boots com,No match >= 70
PRDd593b7b2,Byoma Hydrating Serum,BRD3d853896,Byoma Hydrating,CAT722a51fb,Face Serum,,,12.99,GBP,20251108_121026,uk.byoma.com,byoma hydrating serum,byoma hydrating,face serum,uk byoma com,No match >= 70
PRD2ba82edf,Lancôme Génifique Ultimate Serum,BRD32914710,Lancôme Génifique,CAT722a51fb,Face Serum,,,52.5,GBP,20251108_121026,John Lewis & Partners,lanc me g nifique ultimate serum,lanc me g nifique,face serum,john lewis partners,No match >= 70
PRD5f5233db,NIVEA Luminous 630 Even Glow Serum,BRDe92fa31b,NIVEA Luminous,CAT722a51fb,Face Serum,,,8.49,GBP,20251108_121026,Amazon.co.uk,nivea luminous 630 even glow serum,nivea luminous,face serum,amazon co uk,No match >= 70
PRDe128499b,Balance Active Formula Brightening Serum,BRD39a3f437,Balance Active,CAT722a51fb,Face Serum,,,3.29,GBP,20251108_121026,Wilko,balance active formula brightening serum,balance active,face serum,wilko,No match >= 70
PRD1076b461,Wilko Simple Niacinamide Serum,BRDee28b9c2,Wilko Simple,CAT722a51fb,Face Serum,,,10.0,GBP,20251108_121026,Tesco,wilko simple niacinamide serum,wilko simple,face serum,tesco,No match >= 70
PRDb107d700,E45 Face Hydrating Serum,BRD170ad46c,E45 Face,CAT722a51fb,Face Serum,30.0,ml,11.33,GBP,20251108_121026,Pharmacy2U,e45 face hydrating serum,e45 face,face serum,pharmacy2u,No match >= 70
PRD62474d93,La Roche-Posay Effaclar Ultra Concentrated Serum,BRDaeb421a3,La Roche-Posay,CAT722a51fb,Face Serum,,,32.0,GBP,20251108_121026,Boots.com,la roche posay effaclar ultra concentrated serum,la roche posay,face serum,boots com,No match >= 70
PRD35e141fa,Olay Super Serum 5-in-1 Benefits Hydrating Face Serum,BRD9ddd80c5,Olay Super,CAT722a51fb,Face Serum,50.0,ml,33.32,GBP,20251108_121026,Amazon.co.uk - Amazon.co.uk-Seller,olay super serum 5 in 1 benefits hydrating face serum,olay super,face serum,amazon co uk amazon co uk seller,No match >= 70
PRD3d881715,Liz Earle Restore & Glow Instant Radiance Serum,BRDdec588c4,Liz Earle,CAT722a51fb,Face Serum,,,24.0,GBP,20251108_121026,John Lewis & Partners,liz earle restore glow instant radiance serum,liz earle,face serum,john lewis partners,No match >= 70
PRD72ec1ea2,Aveeno Face Calm Restore Triple Oat Serum,BRDc146f07e,Aveeno Face,CAT722a51fb,Face Serum,,,10.49,GBP,20251108_121026,Boots.com,aveeno face calm restore triple oat serum,aveeno face,face serum,boots com,No match >= 70
PRDd11745ae,Neutrogena Hydro Boost Concentrated Serum,BRDeefe82ad,Neutrogena Hydro,CAT722a51fb,Face Serum,,,9.39,GBP,20251108_121026,Amazon.co.uk - Amazon.co.uk-Seller,neutrogena hydro boost concentrated serum,neutrogena hydro,face serum,amazon co uk amazon co uk seller,No match >= 70
PRDcd662baf,The Ordinary GF 15% Solution,BRDb60306d4,The Ordinary,CAT722a51fb,Face Serum,,,10.39,GBP,20251108_121026,The Ordinary,the ordinary gf 15 solution,the ordinary,face serum,the ordinary,No match >= 70
PRDd7b369b6,The INKEY List Niacinamide Serum,BRD348d9ff9,The INKEY,CAT722a51fb,Face Serum,30.0,ml,5.25,GBP,20251108_121026,The Inkey List,the inkey list niacinamide serum,the inkey,face serum,the inkey list,No match >= 70
PRD036c140f,Nip + Fab Hyaluronic Fix 2% Extreme4,BRD5fb910a1,Nip,CAT722a51fb,Face Serum,,,18.58,GBP,20251108_121026,Amazon.co.uk,nip fab hyaluronic fix 2 extreme4,nip,face serum,amazon co uk,No match >= 70
PRD69fe9110,Laneige Bouncy & Firm Serum,BRDa70a1b0e,Laneige Bouncy,CAT722a51fb,Face Serum,,,31.2,GBP,20251108_121026,John Lewis & Partners,laneige bouncy firm serum,laneige bouncy,face serum,john lewis partners,No match >= 70
PRD329858b7,Dr Althea Vitamin C Boosting Serum,BRDd8327a0a,Dr Althea,CAT722a51fb,Face Serum,,,11.66,GBP,20251108_121026,Justmylook,dr althea vitamin c boosting serum,dr althea,face serum,justmylook,No match >= 70
PRD9c4343cd,The Ordinary Multi-Peptide + HA Serum,BRDb60306d4,The Ordinary,CAT722a51fb,Face Serum,,,21.56,GBP,20251108_121026,The Ordinary,the ordinary multi peptide ha serum,the ordinary,face serum,the ordinary,No match >= 70
PRDff0751f9,Olay Retinol24 Max Night Serum,BRDdb3ee201,Olay Retinol24,CAT722a51fb,Face Serum,,,18.99,GBP,20251108_121026,Amazon.co.uk - Amazon.co.uk-Seller,olay retinol24 max night serum,olay retinol24,face serum,amazon co uk amazon co uk seller,No match >= 70
PRDf80294f8,Evolve Beauty Hyaluronic Serum 200,BRD79867ef4,Evolve Beauty,CAT722a51fb,Face Serum,,,23.25,GBP,20251108_121026,John Lewis & Partners,evolve beauty hyaluronic serum 200,evolve beauty,face serum,john lewis partners,No match >= 70
PRD106fffc7,e.l.f. SKIN Holy Hydration! Triple Bounce Serum,,,CAT722a51fb,Face Serum,,,12.99,GBP,20251108_121026,Superdrug.com,e l f skin holy hydration triple bounce serum,,face serum,superdrug com,No match >= 70
PRD20b225cf,Kiehl's Retinol Skin-Renewing Daily Micro-Dose Serum,BRDcdf1889c,Kiehl's Retinol,CAT722a51fb,Face Serum,,,50.0,GBP,20251108_121026,Kiehl's Official Website,kiehl s retinol skin renewing daily micro dose serum,kiehl s retinol,face serum,kiehl s official website,No match >= 70
PRDf525261a,Q+A Peptide Facial Serum,BRDe5f9c4bb,Q+A Peptide,CAT722a51fb,Face Serum,,,9.0,GBP,20251108_121026,BPerfect Cosmetics,q a peptide facial serum,q a peptide,face serum,bperfect cosmetics,No match >= 70
