product_id,product_name,brand_id,brand_name,category_id,category_name,size_value,size_unit,price,currency,date_collected,retailer_name,product_clean,brand_clean,category_clean,retailer_clean,reason_unmatched
PRD459b7e1a,Little Soap Company Eco Warrior Deeply Nourishing Shampoo Bar,BRDec140568,Little Soap Company,CAT4f1e3d60,Shampoo Bar,,,4.15,GBP,20251108_120316,Amazon.co.uk,little soap company eco warrior deeply nourishing shampoo bar,little soap company,shampoo bar,amazon co uk,No match >= 70
PRDc5fa35a7,Garnier Ultimate Blends Honey Treasures Strengthening Shampoo Bar,BRD162d58fc,Garnier,CAT4f1e3d60,Shampoo Bar,,,4.0,GBP,20251108_120316,Boots.com,garnier ultimate blends honey treasures strengthening shampoo bar,garnier,shampoo bar,boots com,No match >= 70
PRD206c4781,the earthling co. Moisturizing Shampoo Bar,,,CAT4f1e3d60,Shampoo Bar,,,9.5,GBP,20251108_120316,The Earthling Co.,the earthling co moisturizing shampoo bar,,shampoo bar,the earthling co ,No match >= 70
PRD0f0d0418,Kitsch Shampoo Bar Rice Water Protein,BRD84858b44,Kitsch,CAT4f1e3d60,Shampoo Bar,,,8.39,GBP,20251108_120316,Amazon.co.uk - Amazon.co.uk-Seller,kitsch shampoo bar rice water protein,kitsch,shampoo bar,amazon co uk amazon co uk seller,No match >= 70
PRD83f84d5b,Garnier Ultimate Blends Delicate Oat Softening Shampoo Bar,BRD162d58fc,Garnier,CAT4f1e3d60,Shampoo Bar,,,4.0,GBP,20251108_120316,Tesco,garnier ultimate blends delicate oat softening shampoo bar,garnier,shampoo bar,tesco,No match >= 70
PRDe86336bb,Garnier Ultimate Blends Coconut Hydrating Shampoo Bar with Aloe Vera for Normal Hair,BRD162d58fc,Garnier,CAT4f1e3d60,Shampoo Bar,60.0,g,4.0,GBP,20251108_120316,Boots.com,garnier ultimate blends coconut hydrating shampoo bar with aloe vera for normal hair,garnier,shampoo bar,boots com,No match >= 70
PRDcbfb5f45,Alberto Balsam Sunkissed Raspberry Shampoo Bar,BRDc686bb67,Alberto Balsam,CAT4f1e3d60,Shampoo Bar,,,1.09,GBP,20251108_120316,VitaPoint,alberto balsam sunkissed raspberry shampoo bar,alberto balsam,shampoo bar,vitapoint,No match >= 70
PRD71523043,"Nature Triangle Shampoo Bar, Natural Cypress Leaf Usman Grass Solid Shampoo Bar, Calming & Strengthens Hair Vegan, for Hair Care for Women and Mens (",BRDc360e6fd,Nature Triangle,CAT4f1e3d60,Shampoo Bar,,,5.99,GBP,20251108_120316,Amazon.co.uk - Amazon.co.uk-Seller,nature triangle shampoo bar natural cypress leaf usman grass solid shampoo bar calming strengthens hair vegan for hair care for women and mens ,nature triangle,shampoo bar,amazon co uk amazon co uk seller,No match >= 70
PRDc39c546e,Eco Warrior Dry Hair Shampoo Bar,BRDf76fce2c,Eco Warrior,CAT4f1e3d60,Shampoo Bar,,,5.5,GBP,20251108_120316,Tesco,eco warrior dry hair shampoo bar,eco warrior,shampoo bar,tesco,No match >= 70
PRDc5fa35a7,Garnier Ultimate Blends Honey Treasures Strengthening Shampoo Bar,BRD162d58fc,Garnier,CAT4f1e3d60,Shampoo Bar,,,4.0,GBP,20251108_120316,Tesco,garnier ultimate blends honey treasures strengthening shampoo bar,garnier,shampoo bar,tesco,No match >= 70
PRDe42b3890,Faith in Nature - Shampoo Bar Lavender & Geranium,BRD29cd4600,Faith in Nature,CAT4f1e3d60,Shampoo Bar,85.0,g,7.0,GBP,20251108_120316,Holland & Barrett,faith in nature shampoo bar lavender geranium,faith in nature,shampoo bar,holland barrett,No match >= 70
PRD459b7e1a,Little Soap Company Eco Warrior Deeply Nourishing Shampoo Bar,BRDec140568,Little Soap Company,CAT4f1e3d60,Shampoo Bar,,,5.8,GBP,20251108_120316,Waitrose & Partners,little soap company eco warrior deeply nourishing shampoo bar,little soap company,shampoo bar,waitrose partners,No match >= 70
PRD3ac1f6ed,Garnier Ultimate Blends Argan & Camellia Shampoo Bar,BRD162d58fc,Garnier,CAT4f1e3d60,Shampoo Bar,,,4.47,GBP,20251108_120316,Amazon.co.uk - Amazon.co.uk-Seller,garnier ultimate blends argan camellia shampoo bar,garnier,shampoo bar,amazon co uk amazon co uk seller,No match >= 70
PRDf1e29bae,The Highland Soap Co. Seaweed Shampoo Bar,BRD2cd68e6f,The Highland,CAT4f1e3d60,Shampoo Bar,,,7.75,GBP,20251108_120316,The Highland Soap Company,the highland soap co seaweed shampoo bar,the highland,shampoo bar,the highland soap company,No match >= 70
PRD39a03679,ethique Shampoo Bar for Fine,,,CAT4f1e3d60,Shampoo Bar,,,3.0,GBP,20251108_120316,Ethique GB,ethique shampoo bar for fine,,shampoo bar,ethique gb,No match >= 70
PRD17d42fdf,Eco Warrior Nourishing Shampoo Bar,BRDf76fce2c,Eco Warrior,CAT4f1e3d60,Shampoo Bar,,,5.5,GBP,20251108_120316,Tesco,eco warrior nourishing shampoo bar,eco warrior,shampoo bar,tesco,No match >= 70
PRD5cbb3d08,Handmade Solid Shampoo Bar,BRD4e7e12ed,Handmade Solid,CAT4f1e3d60,Shampoo Bar,,,4.49,GBP,20251108_120316,Amazon.co.uk - Amazon.co.uk-Seller,handmade solid shampoo bar,handmade solid,shampoo bar,amazon co uk amazon co uk seller,No match >= 70
PRD214bc95b,Friendly Soap Lavender & Geranium Shampoo Bar,BRD6003a530,Friendly Soap,CAT4f1e3d60,Shampoo Bar,,,3.25,GBP,20251108_120316,Hell Yeah,friendly soap lavender geranium shampoo bar,friendly soap,shampoo bar,hell yeah,No match >= 70
PRDbf7d8f07,"Nature Triangle Shampoo Bar, Usman Grass Shampoo Bar, Nature Seven Green Soap Shampoos Bars, Nourishing Care for Healthy-Looking Hair ()",BRDc360e6fd,Nature Triangle,CAT4f1e3d60,Shampoo Bar,1.0,pcs,9.99,GBP,20251108_120316,Amazon.co.uk - Amazon.co.uk-Seller,nature triangle shampoo bar usman grass shampoo bar nature seven green soap shampoos bars nourishing care for healthy looking hair ,nature triangle,shampoo bar,amazon co uk amazon co uk seller,No match >= 70
PRD073ac21d,Eco Warrior Sensitive Scalp Shampoo Bar,BRDf76fce2c,Eco Warrior,CAT4f1e3d60,Shampoo Bar,,,4.35,GBP,20251108_120316,Waitrose & Partners,eco warrior sensitive scalp shampoo bar,eco warrior,shampoo bar,waitrose partners,No match >= 70
PRD971ea558,OGX Coconut Milk Shampoo Bar,BRD3fc86590,OGX Coconut,CAT4f1e3d60,Shampoo Bar,,,7.49,GBP,20251108_120316,Amazon.co.uk,ogx coconut milk shampoo bar,ogx coconut,shampoo bar,amazon co uk,No match >= 70
PRDbb09309a,Folk Soap Shampoo Bar,BRD3922bcfe,Folk Soap,CAT4f1e3d60,Shampoo Bar,,,6.95,GBP,20251108_120316,Folk Soap,folk soap shampoo bar,folk soap,shampoo bar,folk soap,No match >= 70
PRD223495c4,"Nature Triangle Shampoo Bar, Nature Seven Green Soap Shampoo, Usman Grass ShampooBar, Natural Plant Ingredients, Calming & Strengthens Hair for Women",BRDc360e6fd,Nature Triangle,CAT4f1e3d60,Shampoo Bar,,,9.99,GBP,20251108_120316,Amazon.co.uk - Amazon.co.uk-Seller,nature triangle shampoo bar nature seven green soap shampoo usman grass shampoobar natural plant ingredients calming strengthens hair for women,nature triangle,shampoo bar,amazon co uk amazon co uk seller,No match >= 70
PRD1800de9b,Mint & Tea Tree Shampoo Bar,BRDca8a196f,Mint,CAT4f1e3d60,Shampoo Bar,,,8.5,GBP,20251108_120316,Bare Bar,mint tea tree shampoo bar,mint,shampoo bar,bare bar,No match >= 70
PRDbfb66f63,"Nature Triangle Shampoo Bar, Natural Usman Grass Glutinous Rice Water Solid Shampoo Bar,Thinning Hair-Volume Shampoo Bar for Men and Women,Hair Growth",BRDc360e6fd,Nature Triangle,CAT4f1e3d60,Shampoo Bar,,,6.95,GBP,20251108_120316,Amazon.co.uk - Amazon.co.uk-Seller,nature triangle shampoo bar natural usman grass glutinous rice water solid shampoo bar thinning hair volume shampoo bar for men and women hair growth,nature triangle,shampoo bar,amazon co uk amazon co uk seller,No match >= 70
PRDf3e97cb3,Bleach London Rose Shampoo Bar,BRDc09ecb02,Bleach London,CAT4f1e3d60,Shampoo Bar,,,9.0,GBP,20251108_120316,Boots.com,bleach london rose shampoo bar,bleach london,shampoo bar,boots com,No match >= 70
PRDdd85df46,"Nature Triangle Shampoo Bar, Nature Seven Green Soap shampoo, Seven Green Shampoo bar, Usman Grass Shampoo Bar, Polygonum Shampoo Soap, Calming &",BRDc360e6fd,Nature Triangle,CAT4f1e3d60,Shampoo Bar,,,6.99,GBP,20251108_120316,Amazon.co.uk - Amazon.co.uk-Seller,nature triangle shampoo bar nature seven green soap shampoo seven green shampoo bar usman grass shampoo bar polygonum shampoo soap calming ,nature triangle,shampoo bar,amazon co uk amazon co uk seller,No match >= 70
PRD1abbc9e5,Only Curls Curl Cleansing Shampoo Bar,BRD0aa3e2c2,Only Curls,CAT4f1e3d60,Shampoo Bar,,,12.0,GBP,20251108_120316,Only Curls,only curls curl cleansing shampoo bar,only curls,shampoo bar,only curls,No match >= 70
PRD64e43e15,"Nature Triangle Shampoo Bar - Natural Usman Grass Glutinous Rice Water Solid Shampoo Bar For Hair Care & Hair Growth, Calming & Strengthens Hairs For",BRDc360e6fd,Nature Triangle,CAT4f1e3d60,Shampoo Bar,,,5.55,GBP,20251108_120316,Amazon.co.uk - Amazon.co.uk-Seller,nature triangle shampoo bar natural usman grass glutinous rice water solid shampoo bar for hair care hair growth calming strengthens hairs for,nature triangle,shampoo bar,amazon co uk amazon co uk seller,No match >= 70
PRD0590e833,Davines Love Shampoo Bar,BRD17c01d32,Davines,CAT4f1e3d60,Shampoo Bar,,,18.5,GBP,20251108_120316,Cult Beauty,davines love shampoo bar,davines,shampoo bar,cult beauty,No match >= 70
PRD4633f3ef,"Nature Triangle Shampoo Bar, Usman Grass & Nature Seven Green Soap Solid Shampoo, Gentle Hair Cleansing & Strengthening for Women and Men (1)",BRDc360e6fd,Nature Triangle,CAT4f1e3d60,Shampoo Bar,,,9.98,GBP,20251108_120316,Amazon.co.uk - Amazon.co.uk-Seller,nature triangle shampoo bar usman grass nature seven green soap solid shampoo gentle hair cleansing strengthening for women and men 1 ,nature triangle,shampoo bar,amazon co uk amazon co uk seller,No match >= 70
PRD5c946edc,Amphora Twilight Shampoo Bar,BRD6685437a,Amphora Twilight,CAT4f1e3d60,Shampoo Bar,,,5.95,GBP,20251108_120316,Amphora Aromatics,amphora twilight shampoo bar,amphora twilight,shampoo bar,amphora aromatics,No match >= 70
PRD9f09222c,Nature Triangle Usman Grass Shampoo Bar,BRDc360e6fd,Nature Triangle,CAT4f1e3d60,Shampoo Bar,,,9.97,GBP,20251108_120316,Amazon.co.uk - Amazon.co.uk-Seller,nature triangle usman grass shampoo bar,nature triangle,shampoo bar,amazon co uk amazon co uk seller,No match >= 70
PRD72f1df5a,Tropical Mango Solid Shampoo Bar,BRDd3216cda,Tropical Mango,CAT4f1e3d60,Shampoo Bar,,,7.99,GBP,20251108_120316,Soul and Soap,tropical mango solid shampoo bar,tropical mango,shampoo bar,soul and soap,No match >= 70
PRD7314954f,OnBuy Mini Solid Shampoo Bar Variety Pack,BRD0ed254f3,OnBuy Mini,CAT4f1e3d60,Shampoo Bar,,,11.99,GBP,20251108_120316,Amazon.co.uk - Amazon.co.uk-Seller,onbuy mini solid shampoo bar variety pack,onbuy mini,shampoo bar,amazon co uk amazon co uk seller,No match >= 70
PRDaa501f7b,The Little Goat Soap Company Goats Milk and Neem Oil Shampoo Bar,BRDa8d1ddf7,The Little,CAT4f1e3d60,Shampoo Bar,,,4.95,GBP,20251108_120316,The Little Goat Soap Company,the little goat soap company goats milk and neem oil shampoo bar,the little,shampoo bar,the little goat soap company,No match >= 70
PRD3873f52e,Garnier Ultimate Blends Shampoo Bar Ginger Recovery,BRD162d58fc,Garnier,CAT4f1e3d60,Shampoo Bar,60.0,g,5.25,GBP,20251108_120316,Amazon.co.uk - Amazon.co.uk-Seller,garnier ultimate blends shampoo bar ginger recovery,garnier,shampoo bar,amazon co uk amazon co uk seller,No match >= 70
PRD5cb13c22,Scottish Fine Soaps Vetiver & Sandalwood Shampoo Bar Wrapped,BRDd7296ac2,Scottish Fine,CAT4f1e3d60,Shampoo Bar,100.0,g,6.99,GBP,20251108_120316,The Scottish Fine Soaps Company,scottish fine soaps vetiver sandalwood shampoo bar wrapped,scottish fine,shampoo bar,the scottish fine soaps company,No match >= 70
PRD59ef5692,J.R.Liggett's Original Shampoo Bar,BRD8d2bed0b,J.R.Liggett's Original,CAT4f1e3d60,Shampoo Bar,,,7.99,GBP,20251108_120316,Dolphin Fitness,j r liggett s original shampoo bar,j r liggett s original,shampoo bar,dolphin fitness,No match >= 70
PRD2da155c7,"Nature Usman's Thuja Leaf Shampoo Bar, Nature Triangle Shampoo Bar, Green Soap Triangle Bar, Calming & Strengthens for Women And Men Haircare Products",BRD29659e87,Nature Usman's,CAT4f1e3d60,Shampoo Bar,,,13.99,GBP,20251108_120316,Amazon.co.uk - Amazon.co.uk-Seller,nature usman s thuja leaf shampoo bar nature triangle shampoo bar green soap triangle bar calming strengthens for women and men haircare products,nature usman s,shampoo bar,amazon co uk amazon co uk seller,No match >= 70
PRD1b84c93f,Beauty Kitchen Rosemary Mint Shampoo Bar,BRD464aaf4d,Beauty Kitchen,CAT4f1e3d60,Shampoo Bar,,,10.0,GBP,20251108_120316,Beauty Kitchen,beauty kitchen rosemary mint shampoo bar,beauty kitchen,shampoo bar,beauty kitchen,No match >= 70
PRDe0b70b3d,Yorkshire Goddess Shampoo Bar,BRD62532888,Yorkshire Goddess,CAT4f1e3d60,Shampoo Bar,,,3.5,GBP,20251108_120340,Sheffield Skincare Company,yorkshire goddess shampoo bar,yorkshire goddess,shampoo bar,sheffield skincare company,No match >= 70
PRD51a7ca60,Clarins Nourishing Shampoo Bar,BRDc83c948f,Clarins Nourishing,CAT4f1e3d60,Shampoo Bar,,,16.0,GBP,20251108_120340,Clarins UK,clarins nourishing shampoo bar,clarins nourishing,shampoo bar,clarins uk,No match >= 70
PRD2bb4cb12,FOAmie Aloe Vera Shampoo Bar,BRDf129f64e,FOAmie Aloe,CAT4f1e3d60,Shampoo Bar,,,5.99,GBP,20251108_120340,Amazon.co.uk - Amazon.co.uk-Seller,foamie aloe vera shampoo bar,foamie aloe,shampoo bar,amazon co uk amazon co uk seller,No match >= 70
PRD9ed1bd83,Intense Moisture Shampoo Bar grüum Dry & Heat Damaged,BRDaaa615e0,Intense Moisture,CAT4f1e3d60,Shampoo Bar,,,12.0,GBP,20251108_120340,grüum,intense moisture shampoo bar gr um dry heat damaged,intense moisture,shampoo bar,gr um,No match >= 70
PRD465c7bde,Wideye Green Tea & Eucalyptus Natural Shampoo Bar,BRDef981f03,Wideye Green,CAT4f1e3d60,Shampoo Bar,,,8.95,GBP,20251108_120340,wideye.co.uk,wideye green tea eucalyptus natural shampoo bar,wideye green,shampoo bar,wideye co uk,No match >= 70
PRD4ebccb85,Natural Triangle Usman Grass Shampoo Bar,,,CAT4f1e3d60,Shampoo Bar,2.0,pcs,6.89,GBP,20251108_120340,Amazon.co.uk - Amazon.co.uk-Seller,natural triangle usman grass shampoo bar,,shampoo bar,amazon co uk amazon co uk seller,No match >= 70
PRD645c018b,Old Guys Rule 'Coconut Oil' Shampoo Bar,BRD59cd474c,Old Guys,CAT4f1e3d60,Shampoo Bar,,,4.95,GBP,20251108_120340,Old Guys Rule,old guys rule coconut oil shampoo bar,old guys,shampoo bar,old guys rule,No match >= 70
PRD075efe0b,Naked Soap Free Hair Shampoo Bars,BRD8301ac0d,Naked Soap,CAT4f1e3d60,Shampoo Bar,,,7.0,GBP,20251108_120340,Superfly Soap,naked soap free hair shampoo bars,naked soap,shampoo bar,superfly soap,No match >= 70
PRD48321c1e,Head and Shoulders Anti Dandruff Shampoo Bar With Citrus,BRD98921133,Head,CAT4f1e3d60,Shampoo Bar,70.0,g,6.65,GBP,20251108_120340,Amazon.co.uk - Amazon.co.uk-Seller,head and shoulders anti dandruff shampoo bar with citrus,head,shampoo bar,amazon co uk amazon co uk seller,No match >= 70
PRD0f733f9f,Arista Shampoo Bar Anti-dandruff,BRD27ab859d,Arista Shampoo,CAT4f1e3d60,Shampoo Bar,80.0,g,6.89,GBP,20251108_120340,Fairhaven Wholefoods,arista shampoo bar anti dandruff,arista shampoo,shampoo bar,fairhaven wholefoods,No match >= 70
PRD894e87a6,Classy Camomille* Shampoo Bar,BRDe4130bc1,Classy Camomille*,CAT4f1e3d60,Shampoo Bar,,,7.74,GBP,20251108_120340,Myssyfarmi,classy camomille shampoo bar,classy camomille ,shampoo bar,myssyfarmi,No match >= 70
PRDc0f51385,Eco Warrior Men's Edit Shampoo Bar,BRDf76fce2c,Eco Warrior,CAT4f1e3d60,Shampoo Bar,,,5.5,GBP,20251108_120340,Amazon.co.uk,eco warrior men s edit shampoo bar,eco warrior,shampoo bar,amazon co uk,No match >= 70
PRD4e993f13,Citrus Burst Solid Shampoo Bar,BRDa3a87320,Citrus Burst,CAT4f1e3d60,Shampoo Bar,,,7.0,GBP,20251108_120340,Marigold Charms,citrus burst solid shampoo bar,citrus burst,shampoo bar,marigold charms,No match >= 70
PRDb46a5a02,Ancient Wisdom Solid Shampoo Bar,BRD04af006a,Ancient Wisdom,CAT4f1e3d60,Shampoo Bar,,,3.15,GBP,20251108_120340,Simply Soaperior,ancient wisdom solid shampoo bar,ancient wisdom,shampoo bar,simply soaperior,No match >= 70
PRDe24e6862,Areton HandMade Solid Shampoo Bar,BRD26c40693,Areton HandMade,CAT4f1e3d60,Shampoo Bar,,,3.49,GBP,20251108_120340,Amazon.co.uk - Amazon.co.uk-Seller,areton handmade solid shampoo bar,areton handmade,shampoo bar,amazon co uk amazon co uk seller,No match >= 70
PRD28f0d04b,Goats Of The Gorge Milk Shampoo Bar,BRD5c58c0d3,Goats Of,CAT4f1e3d60,Shampoo Bar,,,4.19,GBP,20251108_120340,Superdrug.com,goats of the gorge milk shampoo bar,goats of,shampoo bar,superdrug com,No match >= 70
PRD6c1d66f0,Faith in Nature Lavender & Geranium Shampoo Bar,BRD29cd4600,Faith in Nature,CAT4f1e3d60,Shampoo Bar,,,7.0,GBP,20251108_120340,Faith in Nature,faith in nature lavender geranium shampoo bar,faith in nature,shampoo bar,faith in nature,No match >= 70
PRDd39ffea1,Bounty Hunter Dry Damaged Hair Shampoo Bar,BRD77c998a0,Bounty Hunter,CAT4f1e3d60,Shampoo Bar,,,6.49,GBP,20251108_120340,Amazon.co.uk - Amazon.co.uk-Seller,bounty hunter dry damaged hair shampoo bar,bounty hunter,shampoo bar,amazon co uk amazon co uk seller,No match >= 70
PRDbc45741b,Davines DEDE Shampoo Bar,BRD17c01d32,Davines,CAT4f1e3d60,Shampoo Bar,,,18.5,GBP,20251108_120340,North Laine Hair Company,davines dede shampoo bar,davines,shampoo bar,north laine hair company,No match >= 70
PRDc3c3e186,Aussie Nourishing Hug Shampoo Bar,BRDa435f839,Aussie Nourishing,CAT4f1e3d60,Shampoo Bar,,,3.5,GBP,20251108_120340,Boop Beauty,aussie nourishing hug shampoo bar,aussie nourishing,shampoo bar,boop beauty,No match >= 70
PRD3d2887a7,Eco Warrior Blue Shampoo Bar,BRDf76fce2c,Eco Warrior,CAT4f1e3d60,Shampoo Bar,,,6.5,GBP,20251108_120340,Justmylook,eco warrior blue shampoo bar,eco warrior,shampoo bar,justmylook,No match >= 70
PRDbec37e07,Natural Vegan Shampoo Bar,BRD397dcdf1,Natural Vegan,CAT4f1e3d60,Shampoo Bar,,,5.35,GBP,20251108_120340,Organics.com,natural vegan shampoo bar,natural vegan,shampoo bar,organics com,No match >= 70
PRD0723e05d,Gently Does It Shampoo,BRD9bc586f1,Gently Does,CAT4f1e3d60,Shampoo Bar,,,13.99,GBP,20251108_120340,We Are Nutrified,gently does it shampoo,gently does,shampoo bar,we are nutrified,No match >= 70
PRDa7e1eac5,ATTITUDE Detox Shampoo Bar,BRD21d79d21,ATTITUDE Detox,CAT4f1e3d60,Shampoo Bar,,,7.94,GBP,20251108_120340,BigGreenSmile.com,attitude detox shampoo bar,attitude detox,shampoo bar,biggreensmile com,No match >= 70
PRD10389236,Herbal Essences Hydrating Vegan Shampoo Bar,BRDb5cf0ce0,Herbal Essences,CAT4f1e3d60,Shampoo Bar,,,6.29,GBP,20251108_120340,Amazon.co.uk - Amazon.co.uk-Seller,herbal essences hydrating vegan shampoo bar,herbal essences,shampoo bar,amazon co uk amazon co uk seller,No match >= 70
PRDeb8c5891,KinKind Shampoo & Bodywash Bars Set,BRDc832dc42,KinKind Shampoo,CAT4f1e3d60,Shampoo Bar,,,9.95,GBP,20251108_120340,KinKind,kinkind shampoo bodywash bars set,kinkind shampoo,shampoo bar,kinkind,No match >= 70
PRDc89a326e,Shampoo Bars Honing,BRDf571eefe,Shampoo Bars,CAT4f1e3d60,Shampoo Bar,,,6.05,GBP,20251108_120340,Boozyshop,shampoo bars honing,shampoo bars,shampoo bar,boozyshop,No match >= 70
PRDf8dd2af5,Project Lavender & Lemongrass Shampoo Bar,BRDcf7bde0d,Project Lavender,CAT4f1e3d60,Shampoo Bar,,,9.0,GBP,20251108_120340,Project Harmless,project lavender lemongrass shampoo bar,project lavender,shampoo bar,project harmless,No match >= 70
PRD5160929d,"Green Soap, Shampoo Bar, Natural Usman Grass Sticky Rice Water Solid Soap, Platycladus Orientalis Leaves Soap, Glutinous Rice Water Solid Shampoo Bar",BRD8d937c83,"Green Soap,",CAT4f1e3d60,Shampoo Bar,,,9.99,GBP,20251108_120340,Amazon.co.uk - Amazon.co.uk-Seller,green soap shampoo bar natural usman grass sticky rice water solid soap platycladus orientalis leaves soap glutinous rice water solid shampoo bar,green soap ,shampoo bar,amazon co uk amazon co uk seller,No match >= 70
PRD4719f24e,Hydrating Conditioning Solid Shampoo Bar,BRD87cbdc1c,Hydrating Conditioning,CAT4f1e3d60,Shampoo Bar,,,9.0,GBP,20251108_120340,Arcade Skincare,hydrating conditioning solid shampoo bar,hydrating conditioning,shampoo bar,arcade skincare,No match >= 70
PRD156eb8db,"Traditional Chinese Herbal Shampoo Soap Bar, Natural Ingredients, Cold Processed",BRDd0bb8c23,Traditional Chinese,CAT4f1e3d60,Shampoo Bar,100.5,g,4.99,GBP,20251108_120340,Amazon.co.uk - Amazon.co.uk-Seller,traditional chinese herbal shampoo soap bar natural ingredients cold processed,traditional chinese,shampoo bar,amazon co uk amazon co uk seller,No match >= 70
PRD39bc4e51,"Turmeric Shampoo Bar,Ginger Hair Regrowth Shampoo Bar with Soap Bag,Natural Solid Shampoo Soap for Strengthen, Volumize & Thicken All Hair Types",BRD8acdc358,Turmeric Shampoo,CAT4f1e3d60,Shampoo Bar,,,7.69,GBP,20251108_120340,Amazon.co.uk - Amazon.co.uk-Seller,turmeric shampoo bar ginger hair regrowth shampoo bar with soap bag natural solid shampoo soap for strengthen volumize thicken all hair types,turmeric shampoo,shampoo bar,amazon co uk amazon co uk seller,No match >= 70
PRDbac6a177,Kitsch Tea Tree & Mint Clarifying Shampoo Bar,BRD84858b44,Kitsch,CAT4f1e3d60,Shampoo Bar,,,11.0,GBP,20251108_120340,Kitsch,kitsch tea tree mint clarifying shampoo bar,kitsch,shampoo bar,kitsch,No match >= 70
PRD5ccc60fe,New Dawn UK Patchouli Shampoo Bar,BRD0034d4a8,New Dawn,CAT4f1e3d60,Shampoo Bar,,,6.45,GBP,20251108_120340,New Dawn Organic Skin and Hair Care,new dawn uk patchouli shampoo bar,new dawn,shampoo bar,new dawn organic skin and hair care,No match >= 70
PRD543307a2,J.R. Liggett's Tea Tree & Hemp Oil Shampoo Bar,BRD927bfd3e,J.R. Liggett's,CAT4f1e3d60,Shampoo Bar,,,9.0,GBP,20251108_120340,John And Ginger,j r liggett s tea tree hemp oil shampoo bar,j r liggett s,shampoo bar,john and ginger,No match >= 70
PRDa15a678b,J.R. Liggett's Herbal Shampoo Bar,BRD927bfd3e,J.R. Liggett's,CAT4f1e3d60,Shampoo Bar,,,10.3,GBP,20251108_120340,BigGreenSmile.com,j r liggett s herbal shampoo bar,j r liggett s,shampoo bar,biggreensmile com,No match >= 70
PRD83cc251e,"Nature Triangle Shampoo Bar: Nature Seven Green Shampoo Soap, Usman Grass Bar, for Women and Mens",,,CAT4f1e3d60,Shampoo Bar,2.0,pcs,12.99,GBP,20251108_120340,Amazon.co.uk - Amazon.co.uk-Seller,nature triangle shampoo bar nature seven green shampoo soap usman grass bar for women and mens,,shampoo bar,amazon co uk amazon co uk seller,No match >= 70
PRDa2770b73,Marcel's Green Soap Shampoo Bar,BRDb9cfd4c9,Marcel's Green,CAT4f1e3d60,Shampoo Bar,,,4.99,GBP,20251108_120340,Amazon.co.uk,marcel s green soap shampoo bar,marcel s green,shampoo bar,amazon co uk,No match >= 70
PRDdd76c9c5,Rainforest Revival Shampoo Bar Subscription,BRDbe3fac9e,Rainforest Revival,CAT4f1e3d60,Shampoo Bar,,,6.95,GBP,20251108_120340,The Soap People,rainforest revival shampoo bar subscription,rainforest revival,shampoo bar,the soap people,No match >= 70
PRD6b91c54a,New Dawn UK Lavender Shampoo Bar,BRD0034d4a8,New Dawn,CAT4f1e3d60,Shampoo Bar,,,6.45,GBP,20251108_120340,New Dawn Organic Skin and Hair Care,new dawn uk lavender shampoo bar,new dawn,shampoo bar,new dawn organic skin and hair care,No match >= 70
PRDbe4a00e2,Ethique Heali Kiwi Solid Shampoo Bar,BRDa4a6260d,Ethique Heali,CAT4f1e3d60,Shampoo Bar,,,8.86,GBP,20251108_120354,eBay,ethique heali kiwi solid shampoo bar,ethique heali,shampoo bar,ebay,No match >= 70
PRDae53ed88,Building Blocks GB LTD Argan Solid Shampoo Bar Eucalyptus,BRD8f118902,Building Blocks,CAT4f1e3d60,Shampoo Bar,115.0,g,2.86,GBP,20251108_120354,Mix.co.uk,building blocks gb ltd argan solid shampoo bar eucalyptus,building blocks,shampoo bar,mix co uk,No match >= 70
PRDc2643e4f,Faith in Nature Shea & Argan Shampoo Bar,BRD29cd4600,Faith in Nature,CAT4f1e3d60,Shampoo Bar,,,5.25,GBP,20251108_120354,Natural Collection,faith in nature shea argan shampoo bar,faith in nature,shampoo bar,natural collection,No match >= 70
PRD6572e1b1,Friendly Soap - Lavender & Tea Tree Shampoo Bar - Eco Friendly,BRD6003a530,Friendly Soap,CAT4f1e3d60,Shampoo Bar,,,2.95,GBP,20251108_120354,Indespoke,friendly soap lavender tea tree shampoo bar eco friendly,friendly soap,shampoo bar,indespoke,No match >= 70
PRDbc45741b,Davines DEDE Shampoo Bar,BRD17c01d32,Davines,CAT4f1e3d60,Shampoo Bar,,,18.5,GBP,20251108_120354,Davines,davines dede shampoo bar,davines,shampoo bar,davines,No match >= 70
PRD67261e04,Kitsch Biotin Purple Toning Shampoo Bar,BRD84858b44,Kitsch,CAT4f1e3d60,Shampoo Bar,,,11.0,GBP,20251108_120354,Kitsch,kitsch biotin purple toning shampoo bar,kitsch,shampoo bar,kitsch,No match >= 70
PRD3a3d296d,Natural Shampoo Bar - Rosemary & Lavender - Wild Sage & Co,BRD0c603f99,Natural Shampoo,CAT4f1e3d60,Shampoo Bar,100.0,g,7.5,GBP,20251108_120354,Peace With The Wild,natural shampoo bar rosemary lavender wild sage co,natural shampoo,shampoo bar,peace with the wild,No match >= 70
PRDe7126446,Pink Sheep Do Exist Shampoo Bar,BRDc2e1536a,Pink Sheep,CAT4f1e3d60,Shampoo Bar,,,7.74,GBP,20251108_120354,Myssyfarmi,pink sheep do exist shampoo bar,pink sheep,shampoo bar,myssyfarmi,No match >= 70
PRD8f7b3df7,Skoon Solid Shampoo Bar Colour & Shine,BRD3937a918,Skoon Solid,CAT4f1e3d60,Shampoo Bar,,,6.76,GBP,20251108_120354,Cloud 10 Beauty,skoon solid shampoo bar colour shine,skoon solid,shampoo bar,cloud 10 beauty,No match >= 70
PRD5d23e71f,Waterworld Sports Natural Lemon Shampoo Bar,BRD7caa4e08,Waterworld Sports,CAT4f1e3d60,Shampoo Bar,,,7.99,GBP,20251108_120354,Green Laurels,waterworld sports natural lemon shampoo bar,waterworld sports,shampoo bar,green laurels,No match >= 70
PRD5fd7f81c,Shampoo bar Nettle and marshmallow to soothe scalp and reduce hair loss,BRD2fb722da,Shampoo,CAT4f1e3d60,Shampoo Bar,,,8.0,GBP,20251108_120354,The Green Turtle,shampoo bar nettle and marshmallow to soothe scalp and reduce hair loss,shampoo,shampoo bar,the green turtle,No match >= 70
PRD071106d5,Wideye Hair Shampoo Bar,BRD74ae9a78,Wideye Hair,CAT4f1e3d60,Shampoo Bar,,,6.95,GBP,20251108_120354,wideye.co.uk,wideye hair shampoo bar,wideye hair,shampoo bar,wideye co uk,No match >= 70
PRD41872344,Bree Probiotic Hair Shampoo Bar,BRD52633366,Bree Probiotic,CAT4f1e3d60,Shampoo Bar,,,10.0,GBP,20251108_120354,Bree Probiotic Skincare,bree probiotic hair shampoo bar,bree probiotic,shampoo bar,bree probiotic skincare,No match >= 70
