product_id,product_name,brand_id,category_id,size_value,size_unit
PRD4e3d419e,KinKind Give Me Strength Rice Protein Shampoo Bar and Conditioner Bar,BRDe0e416ba,CAT5a93da1d,,
PRDc4c1ef94,Solid Conditioner Bar Balance for Greasy Roots and Fine Hair,BRD2bed99ab,CAT5a93da1d,,
PRD44ffb59f,Bounty Hunter Conditioner Bar,BRD77c998a0,CAT5a93da1d,,
PRD2f7a33e2,Conditioner Bar for Normal Hair,BRD5a93da1d,CAT5a93da1d,,
PRD2f6aab64,Kitsch Tea Tree & Mint Clarifying Conditioner Bar,BRD84858b44,CAT5a93da1d,,
PRDc3d06dd4,Kitsch Rosemary & Biotin Solid Conditioner,BRD84858b44,CAT5a93da1d,,
PRDbbd037d5,Conditioner Bars Rosemary,BRD6dca82d8,CAT5a93da1d,,
PRD2b8595a0,Hairy Jayne Floral Conditioner Bar,BRDe2176146,CAT5a93da1d,,
PRDd6386460,Snow Fay Solid Conditioner Bar,BRD1dd7a6f3,CAT5a93da1d,,
PRDe514dd51,Superzero Unisex Curly Colored Hair Conditioner Bar,BRDd5991902,CAT5a93da1d,,
PRDeedf69d3,Ethique Curliosity Solid Conditioner and Co-Wash For Curly Hair,BRD979c219c,CAT5a93da1d,,
PRD17e24350,"Castor Oil Conditioner Bar, Nourishing & Soothing Natural Deep Conditioner for All Hair Types, Strengthening and Moisturizing, Soften Damaged Dry",BRD724ea0ae,CAT5a93da1d,,
PRDcf6f224f,Ethique Solid Conditioner Bar in The Buff - Unscented,BRD7b876250,CAT5a93da1d,60.0,g
PRDc4c9ef37,Naturtint 2 in 1 Frequent Use Shampoo & Conditioner Bar,BRDf5b3de43,CAT5a93da1d,,
PRD4c27d006,Senso Naturale Detangling Hair Conditioner Bar,BRD86f3f14d,CAT5a93da1d,,
PRD989dfc3f,Revitalising Conditioner Bar grüum Dry Damaged & Curly Hair,BRDca3e0db4,CAT5a93da1d,,
PRDf076048b,Herbal Boost Bloom in Soap Refill Conditioner Bar,BRD098f02fb,CAT5a93da1d,,
PRD6cba9b9d,Volume and Body Solid Shampoo & Conditioner,BRDbd7a9717,CAT5a93da1d,,
PRD5dff7be7,Mama Bear's Unscented Conditioner Bar,BRD3417a339,CAT5a93da1d,,
PRD06c6bc74,Unpacked Living Conditioner Bar,BRD19e829fe,CAT5a93da1d,,
PRDd4c284b7,ethique Unscented Conditioner Bar for Sensitive Scalp & Skin 15 Uses,,CAT5a93da1d,,
PRD72bece0b,Luxurious Argan Oil Massage Conditioner Bar,BRD4b611256,CAT5a93da1d,,
PRDa976ca4d,ELEVEN Australia Gentle Hydrate Conditioner Bar,BRDfbe5bb1d,CAT5a93da1d,,
PRDb526dedc,Shampoobars Conditioner Bar,BRDa29db7c7,CAT5a93da1d,,
PRD6018b3c6,Spiced Orange Shampoo and Conditioner Bar Set Plastic Free The Natural Spa,BRDa2ba74d4,CAT5a93da1d,,
PRD58ad51b6,Hope Naturals Vegan Hair Conditioner Bar,BRDc21581e9,CAT5a93da1d,,
PRD7e1101f4,Rebalance Tea Tree Conditioner Bar,BRD3a7ca384,CAT5a93da1d,,
PRD53c08144,RED Silk Conditioner Bar Small Bar (box),BRD4a111d25,CAT5a93da1d,,
PRD64098209,Solid Shampoo Bar and Conditioner Effect Hair Soap,BRD0630498e,CAT5a93da1d,4.0,pack
PRDb8c0a214,grüum Glôs Brightening Lemon Conditioner Bar,,CAT5a93da1d,50.0,g
PRD843209ee,Kitsch Ultra Sensitive Conditioner & Shave Bar,BRD84858b44,CAT5a93da1d,,
PRD4d079077,Shampoo with A Purpose,BRD2fb722da,CAT5a93da1d,,
PRD62f5d3c2,Natural Conditioner Bar - Brittle Heat Damaged Hair - Bain & Savon,BRD97c669a9,CAT5a93da1d,105.0,g
PRDc3eb9414,Honeybee Gardens Lavender Vanilla Conditioner Bar,BRDbd50180f,CAT5a93da1d,,
PRD31434eb6,Alternative Lavender Conditioner Bar,BRD80d7a780,CAT5a93da1d,,
PRDc3898c00,Anihana Conditioner Bar Grapefruit and Lime,BRD1e0aabda,CAT5a93da1d,,
PRD963eb9eb,Metsä/Skogen Morning Mist conditioner bar,BRD3074b1b5,CAT5a93da1d,,
PRD5bb9994d,Lamazuna Solid Conditioner Bar,BRD7f3012e8,CAT5a93da1d,,
PRD5c42e109,Coconut Conditioner Bar,BRD47b72585,CAT5a93da1d,15.0,g
PRDf246c08e,Handmade Natural Conditioner Bar - Peppermint & Eucalyptus,BRD9c1a3733,CAT5a93da1d,,
PRD37a0259b,Natural Conditioner Bar - Oily Hair - Bain & Savon,BRD97c669a9,CAT5a93da1d,105.0,g
PRD484ac341,Coconut Milk Solid Bar Conditioner,BRDea2abbed,CAT5a93da1d,,
PRDa54dce4c,"Castor Oil Hair Bar - Nourishing and Soothing Natural Deep Conditioner for All Hair Types - Moisturizing and Cleansing Bar, Vegan, Smooth and",BRD724ea0ae,CAT5a93da1d,,
PRDa9679b99,shampoobars Conditioner Bar Lavendel,,CAT5a93da1d,,
PRDdff3f624,Caffeine Hair Conditioner Bar for more volume & bounce. Vegan Eco Friendly.,BRD53877812,CAT5a93da1d,,
PRDd7399a7a,Anihana Shampoo & Conditioner Bar Blue Ocean 2-in-1,BRDbed7f8a2,CAT5a93da1d,,
PRDd7a213c1,The Goldilocks Conditioner Bar,BRDfb8d4a92,CAT5a93da1d,,
PRDf1b56856,KinKind Rice Water Conditioner Bar - for Thin Hair,BRD6acdc521,CAT5a93da1d,50.0,g
PRD21bba0b5,The Natural Spa Spiced Orange Conditioner Bar,BRD7e2e7631,CAT5a93da1d,,
PRD6535b194,The Natural Spa Conditioner Bar Patchouli Rose,BRD7e2e7631,CAT5a93da1d,,
PRD886b018a,The Soap Mine Solid Conditioner Bar Lavender & Orange,BRD8b193a76,CAT5a93da1d,,
PRD904f279b,Vancouver Conditioner Bar,BRDe0888cec,CAT5a93da1d,,
PRD29e37778,Ethique Beauty Purple Solid Conditioner Bar,BRDd3418ce0,CAT5a93da1d,,
PRD09c245e0,Extra Care Conditioner Bar for Curly & Frizzy Hair - KinKind,BRD857a0648,CAT5a93da1d,,
PRD0ac04efd,Faith in Nature Conditioner BAR Natural Vegan Plastic Free Dragon Fruit,BRD29cd4600,CAT5a93da1d,,
PRDa1a32eae,ShampooBars Conditioner Bar Melon 60gr,BRDbd217373,CAT5a93da1d,60.0,g
PRDbe4be221,"3 x XHC Shampoo & Conditioner Bars - 2 in 1 Bar- No Plastic Waste - Coconut, Banana & Papaya",,CAT5a93da1d,,
PRD84bffda8,Foamie Hibiscus Conditioner Bar,BRDd7554795,CAT5a93da1d,,
PRDfe53d0ac,Cocoa & Coconut Conditioner Bar,BRD71b5ee5a,CAT5a93da1d,,
PRD3df7b239,Peach Not Plastic Conditioner Bar,BRDf954ab6f,CAT5a93da1d,,
PRD19786b85,m'Chel Haircare Weightless Daily Conditioner Bar,,CAT5a93da1d,,
PRDd03349a2,Anihana Conditioner Bar Grapefruit & Lime For Dry & Coloured Hair,BRD1e0aabda,CAT5a93da1d,,
PRD8d22b41c,Shampoo Bars Conditioner Bar,BRDf571eefe,CAT5a93da1d,,
PRD3b279079,Lime & Bergamot Conditioner Bar | Eco-Friendly Hair Care,BRDfc1cebf0,CAT5a93da1d,,
PRDbe18a438,Sulfate-Free Solid Hair Conditioner Bar! Your choice of scent,BRDcf44d3ba,CAT5a93da1d,,
PRDf8b4251b,"Ethique, The Guardian Solid Conditioner for Normal or Dry Hair",BRD74c8d545,CAT5a93da1d,,
PRDd1570b88,Pure Anada Soothing Natural Conditioner Bar,BRD7d4cfd10,CAT5a93da1d,,
PRDf60cb331,"Coconut Oil Conditioner Bar | Best Bar Conditioner for Dry, Curly, or Frizzy Hair",BRDdf5cda6e,CAT5a93da1d,,
PRD4df45e8d,Back to Basics Solid Conditioner,BRD0557fa92,CAT5a93da1d,,
PRD25a8bdbc,Lemon Conditioner Bars,BRDc3bf812d,CAT5a93da1d,,
PRD9e49e3b1,Ethique Wonderbar Solid Conditioner Bar For Oily/normal Hair,BRDc65aff00,CAT5a93da1d,60.0,g
PRD5cd8f34c,The Natural Spa Cedar Pine Conditioner Bar,BRD7e2e7631,CAT5a93da1d,,
PRD0a4a12d1,Henna conditioner bar for brunette hair | Vegan | Plastic Free | Handmade in UK,BRDa0964868,CAT5a93da1d,,
PRDc17f8c81,Big Pressed Conditioner Bar,BRD7cbd36cb,CAT5a93da1d,,
PRD83fea41d,Rose Geranium Conditioner Bar,BRDd5f15ae1,CAT5a93da1d,,
PRDd1b592c0,HiBAR Solid Moisturize Conditioner Pack of 2,BRD30af8966,CAT5a93da1d,2.7,oz
PRD3bf2efdb,Conditioner Bar Sensitive Scalp,BRD5a93da1d,CAT5a93da1d,,
PRD4ec5cf4d,The Soap Mine Lemongrass & Spearmint Solid Hair Conditioner Bar,BRD8b193a76,CAT5a93da1d,,
PRD18dc55e2,Pure Conditioner Bars For Hair - Tangle Free - Scent Free,BRDc2d0d5e0,CAT5a93da1d,,
PRD28792289,Dip Conditioner Bar Mimosa & Sandalwood Mini,BRD7b07aab3,CAT5a93da1d,,
PRDf84aacf8,Mountain Sky Soaps Apple Cider Conditioner Bar,BRDdfc2a603,CAT5a93da1d,,
PRD2e8de0e7,"bare and bloom Nourish & Shine Solid Conditioner Bar Plastic-Free, Vegan Hair Care for Naturally, Healthy Hair",,CAT5a93da1d,,
PRD2d05ce1e,Keia Softening Conditioner Bar Coconut Oil,BRDd31e974e,CAT5a93da1d,,
PRDc018f492,Matcha Conditioner Bar,BRDdcc705d0,CAT5a93da1d,,
PRDfd7307f5,Bluebell Conditioner Bar Spring Launch 2025,BRDcb8fbc3e,CAT5a93da1d,,
PRD4b1dc885,Handmade Seaweed Conditioner Bar,BRD2c549ca8,CAT5a93da1d,,
PRD22c33c78,Conditioner Bars,BRD6dca82d8,CAT5a93da1d,,
PRD0d89b2c3,Alter/Native Conditioner Bar Pink Grapefruit,BRDd323a280,CAT5a93da1d,,
PRDb221a90b,Ethique Beauty Curl-Defining Solid Conditioner Bar,BRDd3418ce0,CAT5a93da1d,,
PRD61fa6878,Coconut Oil Deep Moisturising Conditioner Bar for Dry/Damaged Hair,BRDdf5cda6e,CAT5a93da1d,,
PRD7d85058c,Patchouli & Rose Geranium Conditioner Bar,BRD1244a248,CAT5a93da1d,,
PRD329a7721,Dip Conditioner Bar & After Swim Detangler,BRD7b07aab3,CAT5a93da1d,,
PRD7e54ffca,Rice & Protein Conditioner Bar for Thinning Hair,BRD5ced19b2,CAT5a93da1d,,
PRD5da04c24,Seasonal Harvest Conditioner Bar,BRD6711900c,CAT5a93da1d,,
PRDcc53d2c7,Grapefruit Conditioner Bar,BRD8df58d7c,CAT5a93da1d,,
PRD85f903dc,Friendly Fragrance Free Conditioner Bar,BRD0a7ed2fd,CAT5a93da1d,,
PRD32707336,Chey Haircare Coconut Conditioner Bar,BRD904b20fe,CAT5a93da1d,,
PRD40d411e6,J.r.liggett S Conditioner Bar,BRDca9f7adf,CAT5a93da1d,,
PRDbbecf8fb,Foamie Coconut Conditioner Bar,BRD5f3052db,CAT5a93da1d,,
PRDc9b3c65a,Anihana Conditioner Bar Lavender & Lemon,BRD1e0aabda,CAT5a93da1d,60.0,g
PRD3f6a2a12,Chamomile Conditioner Bar,BRD46fc98c4,CAT5a93da1d,,
PRD3ee5456d,Ethique Solid Conditioner Bar Kookabara,BRD7b876250,CAT5a93da1d,,
PRDabecb836,Citrus Mini Conditioner Bar Sampler - gift set with 4 mini conditioner bars,BRDf895d595,CAT5a93da1d,,
PRD7d5051ba,be CLEAR Oily Hair Conditioner Bar,,CAT5a93da1d,,
PRDd59f770d,Naked Conditioner Bar,BRD3b4f9926,CAT5a93da1d,,
PRDce3bdf79,Notice Hair Co. Detoxifier Conditioner Bar,BRD4877b421,CAT5a93da1d,,
PRDc5d563ff,Herbalicious Conditioner Bar,BRDd2ed30ca,CAT5a93da1d,25.0,g
PRDf1842781,Color Safe Daily Conditioner Bars,BRDba89bfdf,CAT5a93da1d,,
PRD8ff68e4e,grüum Glôs Zero Plastic Anti-Dandruff Conditioner Bar,,CAT5a93da1d,50.0,g
PRDa06a6131,Coconut Oil Deep Moisturising Conditioner Bar For Dry/damaged Hair,BRDdf5cda6e,CAT5a93da1d,,
PRD71e99c8f,Alter/Native Conditioner Bar | Pink Grapefruit,BRDd323a280,CAT5a93da1d,,
PRD8cdfbccc,Conditioner Bar - Patchouli & Rose Geranium,BRD5a93da1d,CAT5a93da1d,,
PRD3a3747bb,Tone It Down Solid Conditioner,BRDc729b762,CAT5a93da1d,,
PRD7ac74554,Solid Conditioner Bar - Unscented,BRD2bed99ab,CAT5a93da1d,,
PRD54737dde,Vegan Conditioner Bars - - Plastic Free - Eco Friendly - 4 Scents,BRDa37efa11,CAT5a93da1d,55.0,g
PRDd0392353,Soapbox Hair Conditioner Bar with Argan Oil,BRDd6356cc9,CAT5a93da1d,,
PRD8f318b07,Vital Flow Conditioner Bar – Hydration and Definition for Curls and Dry Hair Hydrating | Curl Defining | Frizz Control,BRD544f8f9d,CAT5a93da1d,,
PRD05d587d2,Beach Road Naturals -conditioner Bar X 2 Hemp Seed Oil & Juniper,BRDa008f923,CAT5a93da1d,70.0,g
PRD66082654,Bain & Savon Ltd Conditioner Bar,BRD6eeb157d,CAT5a93da1d,,
PRDb112ac18,Lush The Golden Cap Conditioner,BRDb11a546f,CAT5a93da1d,,
PRDc69720c2,Friendly Fragrance free conditioner bar,BRD0a7ed2fd,CAT5a93da1d,,
PRD6fda8706,Volumizing Conditioner Bar with Biotin for thin fine hair - Plastic-Free Vegan Cruelty-Free,BRD2665bd6b,CAT5a93da1d,2.12,oz
PRDd3dff46f,Luscious Locks Conditioner Bar,BRD3f4591f3,CAT5a93da1d,,
PRD4e94461b,Friendly Soap Conditioner Bar - Lavender & Tea Tree (pack Of 6),BRD6003a530,CAT5a93da1d,95.0,g
PRDe37f9992,Curling Me Softly Deep Conditioning Bar | Salt + Steam,BRDac283ccf,CAT5a93da1d,,
PRD10e88f33,Shampoo Bars Conditioner Bar Honing,BRDf571eefe,CAT5a93da1d,,
PRDd675eb31,"Solid Shampoo Bar & Conditioner Bar Set For Curly, Wavy, Coily And",BRD0630498e,CAT5a93da1d,,
PRDc3694bbe,Foamie Shake Your Coconuts Conditioner Bar,BRD2b40d24b,CAT5a93da1d,,
PRD46fbeb9a,Greenum Solid Conditioner Bar,BRD537c2608,CAT5a93da1d,,
PRD9ea4972f,Sustainable Haircare Canopy Series Conditioner Bar Twin,BRD71b5dc21,CAT5a93da1d,,
PRD20db5c4a,Banana Solid Conditioner Bar,BRD55b477ae,CAT5a93da1d,,
PRD05a78c1c,(bulkx6) Anihana Conditioner Bar Manuka Honey & Vanilla -all Hair,,CAT5a93da1d,60.0,g
PRD3a4157bd,Conditioner bar for colored hair,BRD1c6763b0,CAT5a93da1d,,
PRD6890dbd7,Herbal Boost Bloom in Soap Hair Conditioner Bars,BRD098f02fb,CAT5a93da1d,,
PRD9ee620bb,Raw Roots Conditioner Bar,BRDa811f75f,CAT5a93da1d,,
PRD19bed18c,Mango Solid Conditioner Bar,BRD98e56363,CAT5a93da1d,,
PRD0a2bc236,Grown Man Co Chill Out Conditioner Bar,BRDfc3651fd,CAT5a93da1d,,
PRD55b6b246,Oily Hair Conditioner Bar,BRD92717983,CAT5a93da1d,,
PRD98e3b410,Lemon Conditioner Bar For All Hair Types,BRDc3bf812d,CAT5a93da1d,,
PRDee0124b8,Lemongrass Solid Conditioner Bar,BRD9cbb0bd4,CAT5a93da1d,,
PRDffb011c9,Patchouli Rose Nourishing Conditioner Bar For All Hair Types,BRDe8804c07,CAT5a93da1d,,
PRDc8485a28,Lavender and Lime Solid Conditioner,BRDe346c232,CAT5a93da1d,,
PRD99303b82,Conditioner Bar - - Lavender & Geranium | Friendly Soap,BRD6003a530,CAT5a93da1d,12.0,pack
PRD2b3258b1,"Sensitive Solid Conditioner, 60",BRDd9daed7c,CAT5a93da1d,,
PRD542f16dd,Pure Conditioner Bar For All Hair Types,BRDc2d0d5e0,CAT5a93da1d,,
PRD80202c26,Clever Yoga Wave Unscented Conditioner Bar,BRD929efbc8,CAT5a93da1d,,
PRDd3af8cc1,Rosemary Lime Nourishing Conditioner Bar For All Hair Types,BRDaec4ff15,CAT5a93da1d,,
PRD9a9d8872,Viori Terrace Garden Conditioner Bar,BRDe21ccb1d,CAT5a93da1d,,
PRDc3647fd8,CONDITIONER BAR LAVENDER - PURC CONDITIONER BAR LAVENDER CRUELTY FREE VEGAN CONDITIONER BAR,BRD9c9e2256,CAT5a93da1d,,
PRDa1005f77,Lemon Solid Conditioner - Hair & Bee Solid Conditioner Bar Conditioner bar in tin,BRD8ac1ed10,CAT5a93da1d,,
PRD42802fa8,Solid Rice Protein Water Conditioner Bar,BRD0804cba4,CAT5a93da1d,,
PRDaed0941e,Solid Conditioner Bar ~ Sweet & Fruity Scents,BRD2bed99ab,CAT5a93da1d,,
PRDe4a75ca8,Hairy Jayne Solid Conditioner Bar,BRDe2176146,CAT5a93da1d,,
PRD915e49ef,Conditioner bar,BRD1c6763b0,CAT5a93da1d,15.0,g
PRD85e09e17,Craftery The Natural Spa Fresh Mini Conditioner Sampler Gift Set,BRD2bd8a513,CAT5a93da1d,,
PRD85dafdb6,RAWROOTS.eu Conditioner Bar,BRD4870f09a,CAT5a93da1d,,
PRD1f1b0352,"Coconut Conditioner Bar - Rich Nourishing & Volumizing - Hair Moisturizing & Strengthening Solid Soap Bar, Plastic-Free, Silicone & Sulfate Free",BRD47b72585,CAT5a93da1d,,
PRDb079a19b,Vegan Hair Conditioner Bar,BRDce1b5c14,CAT5a93da1d,55.0,g
PRD86f30984,janni bars Cú Chulainn Conditioner,,CAT5a93da1d,,
PRD5cc056bd,Conditioner Bar for Hair Growth,BRD5a93da1d,CAT5a93da1d,,
PRD4619ebd6,Shea Butter Conditioner Bar,BRD22d23b78,CAT5a93da1d,,
PRD5070afed,Mars Made Rosemary Conditioner Bar,BRD6c1c7451,CAT5a93da1d,,
PRDd7dd6249,Natural Handmade Hair Conditioner Bar/eco Friendly/paraben Free/sls,BRDa797411d,CAT5a93da1d,,
PRD2842dc94,"Solid Conditioner Bar, Lemon",BRD2bed99ab,CAT5a93da1d,,
PRD9529a267,"Rice Protein Conditioner Bar for Thinning Hair - Volume Conditioner Bar for Strengthening Hair Roots, Hair Thickening & Nourishing and Hydrating",BRD98c2b3b0,CAT5a93da1d,,
PRD9b658d6c,Rosemary/Rice Biotin and Conditioner Bar Set for Thinning,BRD982e428c,CAT5a93da1d,,
PRD5f3f5d9c,Starbars Clarity Conditioner Bar,BRD7cdc6a62,CAT5a93da1d,,
PRDfc2db389,Natural Conditioning Bar,BRD2c3047ff,CAT5a93da1d,35.0,g
PRDb89aac30,ZWS Essentials Driftwood Conditioner Bar,BRDff63fc0f,CAT5a93da1d,,
PRDe2369596,Custom Conditioner Bar – Choose Hair Type & Scent | Plastic-Free Eco-Friendly Hair Care,BRD3d313dff,CAT5a93da1d,,
PRD43d4a4a0,Viori Chamomile Rose Essential Oil Conditioner Bar,BRDc000ed6b,CAT5a93da1d,,
PRD6ac91761,Coconut Curls Conditioning Shampoo Bar,BRD422315c4,CAT5a93da1d,,
PRD4e147b1f,ECOAND Silky Vegan Conditioner Bar,BRD243dd400,CAT5a93da1d,,
PRDce9b3f2d,The Ordinary Niacinamide 10% + Zinc 1%,BRDb60306d4,CAT722a51fb,,
PRD04855e74,BYOMA Brightening Serum,BRD5f1fef73,CAT722a51fb,,
PRDc32dd309,The Ordinary Hyaluronic Acid 2% + B5,BRDb60306d4,CAT722a51fb,,
PRD13bb90a1,Garnier Brightening Serum,BRD162d58fc,CAT722a51fb,,
PRDf4b0965c,CeraVe Resurfacing Retinol Serum,BRDcaf53d2a,CAT722a51fb,,
PRD9a7570fa,Balance Active Vitamin C Brightening Serum,BRD39a3f437,CAT722a51fb,30.0,ml
PRDc2dfccb3,Nivea Luminous630 Skin Glow Serum,BRD8247a077,CAT722a51fb,,
PRDaa61c7c6,Clarins Double Serum,BRD90670411,CAT722a51fb,,
PRD71c2b6fe,Simple Repair Ceramide & Omega Complex Face Serum,BRD0153c99d,CAT722a51fb,,
PRDf0be21d5,L'Oreal Paris Age Perfect Cell Renew Midnight Serum,BRD2d6145f0,CAT722a51fb,,
PRD8735fe9a,Q+A Hyaluronic Acid Facial Serum,BRD2ccb18e9,CAT722a51fb,,
PRDbf08692f,Simple Serum 10% Vitamin C + E + F Booster Serum,BRD888ecf88,CAT722a51fb,,
PRDee65acfa,Estée Lauder Advanced Night Repair Serum Synchronized Multi Recovery Complex,BRDc8d730ed,CAT722a51fb,,
PRD22c09faf,Drunk Elephant C-Luma Hydrabright Serum,BRD4b9060c9,CAT722a51fb,,
PRDb4f21699,Anua Niacinamide Dark Spot Correcting Serum,BRDf1b28936,CAT722a51fb,,
PRDcfedb625,Olay Niacinamide 24 + Vitamin E Age Defy Serum,BRD4598025e,CAT722a51fb,,
PRD1fb6a514,La Roche Posay Effaclar Ultra Concentrated Serum,BRD6370d8a0,CAT722a51fb,30.0,ml
PRDd593b7b2,Byoma Hydrating Serum,BRD3d853896,CAT722a51fb,,
PRDb107d700,E45 Face Hydrating Serum,BRD170ad46c,CAT722a51fb,30.0,ml
PRD53c531eb,BYOMA Clarifying Serum,BRD0228b8bf,CAT722a51fb,,
PRDf525261a,Q+A Peptide Facial Serum,BRDe5f9c4bb,CAT722a51fb,,
PRD72ec1ea2,Aveeno Face Calm Restore Triple Oat Serum,BRDc146f07e,CAT722a51fb,,
PRDd11745ae,Neutrogena Hydro Boost Concentrated Serum,BRDeefe82ad,CAT722a51fb,,
PRDcd662baf,The Ordinary GF 15% Solution,BRDb60306d4,CAT722a51fb,,
PRDcec19d98,The INKEY List Hyaluronic Acid Serum,BRD348d9ff9,CAT722a51fb,,
PRDfce740e3,CeraVe Hydrating Hyaluronic Acid Serum,BRDcb138aa0,CAT722a51fb,,
PRD036c140f,Nip + Fab Hyaluronic Fix 2% Extreme4,BRD5fb910a1,CAT722a51fb,,
PRDad518304,No7 Laboratories Firming Booster Serum,BRD418e028d,CAT722a51fb,7.0,l
PRD6141f325,Boots Ingredients Hyaluronic Acid Serum,BRDabd6802c,CAT722a51fb,,
PRDff0751f9,Olay Retinol24 Max Night Serum,BRDdb3ee201,CAT722a51fb,,
PRD329858b7,Dr Althea Vitamin C Boosting Serum,BRDd8327a0a,CAT722a51fb,,
PRD2583e716,The Ordinary Soothing & Barrier Support Serum,BRDb60306d4,CAT722a51fb,,
PRD1ecdc628,Medicube PDRN Pink Peptide Serum,BRD062f3632,CAT722a51fb,,
PRDf204f305,Clinique Moisture Surge Active Glow Serum,BRD11fefa6e,CAT722a51fb,,
PRDe522a9dd,La Roche Posay Cicaplast B5 Serum,BRD6370d8a0,CAT722a51fb,,
PRD087cdfec,L'Oreal Revitalift Filler Serum 1.5% Hyaluronic Acid,BRD66d4d866,CAT722a51fb,30.0,ml
PRD76c234bd,Beauty of Joseon Glow Serum,BRD7a7f3a70,CAT722a51fb,,
PRDb0ac7648,Miracle Serum Revolution Pro,BRD62513a05,CAT722a51fb,,
PRD65b963dd,Vichy Mineral 89,BRD39461270,CAT722a51fb,,
PRD54208145,Caudalie Vinoperfect Brightening Dark Spot Serum,BRD461bcee4,CAT722a51fb,,
PRD60c141e5,The Ordinary Retinol 1% in Squalane,BRDb60306d4,CAT722a51fb,,
PRD2c51af42,No7 Laboratories Line Correcting Booster Serum,BRD418e028d,CAT722a51fb,7.0,l
PRD141340f5,Estée Lauder Advanced Night Repair Serum,BRDc8d730ed,CAT722a51fb,,
PRD4e1a936f,Belif Super Drops Brightening Serum,BRDab0faa72,CAT722a51fb,,
PRDe012315c,Medicube Triple Collagen Serum 4.0,BRDfcd05189,CAT722a51fb,,
PRD533daf5f,Estée Lauder Advanced Night Repair Rescue Solution Serum,BRDc8d730ed,CAT722a51fb,,
PRDe2709404,Clarins Bright Plus Advanced Brightening Serum,BRD8185af01,CAT722a51fb,,
PRD362c3ff2,Elizabeth Arden Advanced Ceramide Capsules Daily Youth Restoring Serum,BRD5cb1fb40,CAT722a51fb,,
PRD7aed8ed6,The INKEY List 15 Serum,BRD348d9ff9,CAT722a51fb,,
PRD9f209bc8,Ole Henriksen Banana Bright Vitamin C Serum,BRDb7139e52,CAT722a51fb,7.0,ml
PRD572b7f12,NIVEA Cellular Luminous 630 Anti Dark Spot Face Serum,BRD9dfb3177,CAT722a51fb,,
PRDb493eaaf,Medik8 Hydr8 B5 Intense,BRDc93e4fc3,CAT722a51fb,,
PRD50974ccd,Organic Shop Pumpkin & Honey Pore Minimizing Face Serum,BRD47539b2f,CAT722a51fb,,
PRDcb19610a,Curel Anti-Wrinkle Hydrating Serum,BRD97a74db7,CAT722a51fb,,
PRD644f63a1,Q+A Brightening Serum,BRD1e657213,CAT722a51fb,,
PRD21431f29,EQQUALBERRY Bakuchiol Plumping Serum,BRD73a28b8c,CAT722a51fb,,
PRD13373e04,L'Oreal Revitalift Laser Renew Anti-Ageing Super Serum,BRD66d4d866,CAT722a51fb,,
PRD515f0b43,The INKEY List Supersize Hyaluronic Acid Serum,BRD348d9ff9,CAT722a51fb,,
PRD45e31827,Charlotte Tilbury Dark Spot Correcting Radiance Recovery Serum,BRD7e67dd22,CAT722a51fb,,
PRD4943cccd,LANCÔME Rénergie H.C.F Triple Serum,BRD91d1dabb,CAT722a51fb,,
PRDcfedc15d,UpCircle Peptide Serum,BRDc0da061c,CAT722a51fb,30.0,ml
PRDc1765665,Simple Booster Serum 3% Hyaluronic Acid & B5,BRDeda055ab,CAT722a51fb,,
PRDa8b7ad71,Murad Vita-C Glycolic Brightening Serum,BRD5e364f27,CAT722a51fb,,
PRD1914ccb4,Glow Skin Glow Face Serum Collagen & Salicylic Acid,BRDb99e0d03,CAT722a51fb,50.0,ml
PRDe4e77336,Olay Super Serum Face Serum Vitamin C,BRD9ddd80c5,CAT722a51fb,,
PRDf0bd19e6,Some By Mi Retinol Intense Reactivating Serum,BRD10f609e0,CAT722a51fb,,
PRDaae6fd55,AURA Face Serum - Smoothing,BRD1862c8a7,CAT722a51fb,100.0,ml
PRDc8bf0ee5,EQQUALBERRY Illuminating Serum,BRDe913bd96,CAT722a51fb,,
PRD1b5ea679,Cien Q10 Serum,BRD056e8f23,CAT722a51fb,,
PRDc464793a,Dr Barbara Sturm Hyaluronic Serum,BRDf41fd2f8,CAT722a51fb,,
PRDf9098fb3,B. Intense Hydrating Serum,BRD2dd9f277,CAT722a51fb,,
PRDc07dec94,Purito Hydro Wave Deep Sea Serum,BRDcceaacbf,CAT722a51fb,,
PRD81e90efe,Horace Men's Radiance Boost Serum,BRDae5cb146,CAT722a51fb,,
PRDf6830cac,SUPERDRUG Vitamin C Booster Travel Mini,BRD44a8ccbf,CAT722a51fb,,
PRDde8584bd,Neal's Yard Remedies Wild Rose Beauty Serum,BRD78d7a07c,CAT722a51fb,,
PRD6c6e976a,The Ordinary Soothing & Barrier Support Serum Set,BRDb60306d4,CAT722a51fb,,
PRDcd1773fa,Weleda Skin Food Glow Serum Drops,BRD5abb5e7c,CAT722a51fb,,
PRDef72d6cb,Radiance Serum,BRD58aa6856,CAT722a51fb,,
PRDf4228adf,Drunk Elephant Protini Powerpeptide Resurf Serum,BRD4b9060c9,CAT722a51fb,,
PRDdf360155,Paula's Choice 10% Niacinamide Booster,BRD793e8c8e,CAT722a51fb,,
PRD70197a07,Skin Rocks The Antioxidant Face Serum,BRD55a56ab0,CAT722a51fb,,
PRDc7d1bc04,Garnier Vitamin C Night Serum,BRD162d58fc,CAT722a51fb,,
PRD3204910d,Beauty Pie Youthbomb Extreme Retinal Triple Renewal Serum,BRDe030495a,CAT722a51fb,,
PRD352a3d59,"Avocado Face Serum, Hydrating Serum with 15% Milk, Soothing Hyaluronic Acid Serum, Serums Skincare, Avocado Face Serum for Women, Redness Relief",BRD57d25278,CAT722a51fb,,
PRD2ea5bf27,Natura Siberica Royal Caviar Revitalizing Face Serum,BRD6ca0b79a,CAT722a51fb,,
PRD524f056e,Neal's Yard Remedies Hyaluronic Acid Booster,BRD78d7a07c,CAT722a51fb,,
PRD0f58d1c0,Dark Spot Correcting Glow Serum,BRD74a8f573,CAT722a51fb,,
PRD782d72dd,Naturally Tiwa Skincare MIMO Facial Serum,BRDd0223e43,CAT722a51fb,,
PRD0442500e,Antipodes Glow Ritual Serum,BRD2b3b6d70,CAT722a51fb,,
PRD6715954f,Good Molecules Niacinamide Serum,BRD4915386c,CAT722a51fb,,
PRD61ae0a53,Medik8 Crystal Retinal 6,BRDd2aeb642,CAT722a51fb,,
PRD5eb0fa2b,The Ordinary Argireline Solution,BRDb60306d4,CAT722a51fb,,
PRD66b9bcfc,UpCircle Peptide Serum Travel Size,BRDc0da061c,CAT722a51fb,,
PRD85e96253,Victoria Beauty Hyaluron+ Day and Night Face Serum,BRD72ac0a4e,CAT722a51fb,,
PRD18eee5aa,Face Facts Facial Serum,BRD17a4bdf6,CAT722a51fb,,
PRD0f7ef89e,Anti-Ageing Power Face Serum,BRD893405ed,CAT722a51fb,,
PRDf06273d2,The Ilex Wood Frankincense and Bergamot Facial Serum,BRD62452f06,CAT722a51fb,,
PRD88222f1e,B. Brightening Serum,BRD705ae1cc,CAT722a51fb,30.0,ml
PRDd9120eec,Bioderma Pigmentbio C-Concentrate Face Serum,BRDab7ed224,CAT722a51fb,15.0,ml
PRD01d9eb46,Dr. Andrew Weil for Origins Mega-Mushroom Relief & Resilience Advanced Face Serum,BRD5a3e69e0,CAT722a51fb,,
PRDd1e8e0f4,Eqqualberry Vitamin Illuminating Serum,BRD30decca8,CAT722a51fb,,
PRD88788854,Arencia Rice Mucin Glow Serum 30,BRD6bbeab5e,CAT722a51fb,,
PRDe3ace2f1,Eucerin Hyaluron-Filler + Elasticity 3D Serum,BRDad122270,CAT722a51fb,,
PRDc0d74429,Charlotte Tilbury Magic Crystal Elixir Serum,BRD7e67dd22,CAT722a51fb,,
PRDa9143a2c,Good Molecules Daily Brightening Serum,BRD4915386c,CAT722a51fb,,
PRDa6374819,"COWANIEE Plants Hyaluronic Acid Serum, Hyaluronic Acid and Collagen Face Serum",BRD28a8127e,CAT722a51fb,,
PRDc054ffcc,NIVEA Cellular Epigenetics Age Rewind Face Serum with Epicelline,BRD9dfb3177,CAT722a51fb,,
PRDa174d17f,Brightening & Hydrating Face Serum,BRD0c77d82b,CAT722a51fb,,
PRDa91f279b,Alteya Organic Iridescent Light Serum,BRDfff007d5,CAT722a51fb,,
PRD8d052b05,transparent lab Gentle Rejuvenation Serum,,CAT722a51fb,,
PRD422ba6df,This Works In Transit Vit C Serum,BRD9c7bffd7,CAT722a51fb,,
PRD05f3959d,Geek & Gorgeous 101 HA 5 Rich Serum,BRD13f3648e,CAT722a51fb,,
PRDab4c682d,Anua 7 Rice Ceramide Hydrating Barrier Serum,BRD8531a0e5,CAT722a51fb,,
PRDfd6b17b8,Replenish & Strengthen Squalane Serum,BRDebb32cc5,CAT722a51fb,,
PRD0df0ca2b,KSECRET SEOUL 1988 Serum Retinal Liposome 2% + Black Ginseng,BRD682cfc9b,CAT722a51fb,,
PRDb2e4bfa8,Tinted Serum with Aloe Vera,BRDbf6abe5d,CAT722a51fb,,
PRD69424500,Garancia Etoile Polaire Supreme Serum,BRDe6ba7770,CAT722a51fb,,
PRDfeefc175,Depology Matrixyl 3000 Serum Anti Wrinkle Korean Skin Care Travel Set,BRD4646f2cb,CAT722a51fb,30.0,ml
PRD9f59fc8c,"Stem Cell Serum for Face, Stem Cell Solution Ampoule for Firmer & Anti-Aging, Hydrating Facial Serum /1.2 Fl Oz",BRD60b433e3,CAT722a51fb,35.0,ml
PRDf44da045,Seacret Bio Skin Glow Night Serum,BRD86efc973,CAT722a51fb,,
PRD4a58979a,Nacomi Next Level Ceramide Serum,BRD59a57778,CAT722a51fb,,
PRD61f260f0,"Facial Serum 10% Hyaluronic Acidanti-Wrinkle,Antipigmentation Face Serum For Men & Women Repairing Fine Lines, Wrinkles And Dryness Of The Skin",BRD5e6546ae,CAT722a51fb,,
PRD9f809d85,Nivea Men's Anti-Age 2in1 Power Serum,BRD200a1992,CAT722a51fb,,
PRD1424884c,iS Clinical GeneXC Serum,,CAT722a51fb,,
PRD22974641,Alpha H Hyaluronic 8 Super Serum,BRD9116b5d5,CAT722a51fb,,
PRD75ee036b,Give Me Hyaluronic Acid Face Serum,BRD05ca013d,CAT722a51fb,,
PRDf97646d2,Good Molecules Discoloration Correcting Serum,BRD4915386c,CAT722a51fb,,
PRD635c18c5,Collagen Serum,BRDd409a9d5,CAT722a51fb,30.0,ml
PRD7957e4a6,WildMint Cosmetics Youth Boost Serum,BRDeaa9bc43,CAT722a51fb,,
PRD38218e1e,Qure All-in-One Face Serum,BRD90954534,CAT722a51fb,,
PRDd15c29cf,Beauty Bay Refine + Soothe Serum,BRD0a452012,CAT722a51fb,,
PRD9777851b,Elizabeth Arden Retinol + HPR Ceramide Capsules Rapid Skin Renewing Serum,BRD5cb1fb40,CAT722a51fb,,
PRD30d3a711,Hyaluronic Acid Serum 100% Pure Timeless Skin Care,BRD4ee63158,CAT722a51fb,,
PRD23a200da,Dorothy Perkins Unisex Face Serum,BRDb98e5474,CAT722a51fb,,
PRDf3e10ec7,Jeremy & Edelyn's Beauty and Care Facial Serum,BRD877b13f2,CAT722a51fb,,
PRD567c64ac,Estee Lauder Advanced Night Repair Serum 4-Piece Skincare Gift Set,BRD4a2d1f22,CAT722a51fb,,
