product_id,product_name,brand_id,category_id,size_value,size_unit
PRDc3707100,SkinCeuticals P-Tiox Serum,BRD5a808eba,CAT722a51fb,,
PRDfbb36da5,Arencia Holy Hyssop Serum 30,BRDdc88e1db,CAT722a51fb,,
PRD4c724a6d,Eveline Face Therapy Multi Peptides Serum Shot,BRD678e8c69,CAT722a51fb,,
PRDb976da70,Plant Therapy Facial Serum Trio Set,BRD59d167a6,CAT722a51fb,,
PRDbf686ef6,Face Facts Glow & Resurface Lactic Acid Serum,BRD17a4bdf6,CAT722a51fb,,
PRD1a37a082,The Ordinary Marine Hyaluronics,BRDb60306d4,CAT722a51fb,30.0,ml
PRD0c13e4a4,Omic Skincare Face Serum,BRD79bfc1ac,CAT722a51fb,,
PRD22ea2cd6,Onbuy Premium 20% Serum for Face,BRDc22930cb,CAT722a51fb,,
PRDc9fa0230,Turmeric Face Serum - Dark Spot Remover For Face- Serum Face For Healthy And Plump Skin - Hyaluronic Acid Serum For Soothing & Hydrating - Face,BRD6034db37,CAT722a51fb,,
PRD766a90ed,The INKEY List Serum,BRD348d9ff9,CAT722a51fb,,
PRD7ff763c0,Neutrogena Bright Boost Illuminating Serum,BRDddff584e,CAT722a51fb,,
PRD91831444,Liz Earle Skin Repair Serum,BRDdec588c4,CAT722a51fb,,
PRD25de8360,Bondi Sands Begin Again Serum,BRD20c2ca0d,CAT722a51fb,,
PRDf25866b2,Gooseberry Dark Spot Brightening Serum,BRDa04fb6ca,CAT722a51fb,,
PRDb9a2d8b5,La Rosée Plumping Face Serum,BRDc6dc435f,CAT722a51fb,30.0,ml
PRDd807822d,Abib Heartleaf TECA Capsule Serum Calming Drop,BRD3c10e3d0,CAT722a51fb,,
PRDdb639c8a,"Korean Skin Care 20% Vitamin C Serum,Vitamin C Moisturiser for Face,Vitamin C Brightening Serum,wrinkle serum,Anti-Aging Face Serum for Glowing Skin",BRD3419cc42,CAT722a51fb,,
PRDcdf57021,Obagi Daily Hydro-Drops Facial Serum,BRDb255df89,CAT722a51fb,,
PRD49901764,"Boto-xface Stock Solution Facial Serum,Boto-xface Face Cream,Anti Aging Serum for Face,Collagen Boost Anti-Aging Serum,Face Tightening Serum",BRDaf546a11,CAT722a51fb,,
PRDa49bc1c6,juvena Specialist Miracle Firm & Hydrate Serum,,CAT722a51fb,,
PRDd28843d1,Vichy Liftactiv Retinol Specialist Serum,BRDb47d5418,CAT722a51fb,,
PRDd7b89f40,BYOMA Brightening Serum Refill,BRD5f1fef73,CAT722a51fb,30.0,ml
PRDdd08da58,"Liquid Solution Anti Aging Serum,Bo-Tox Liquid Serum, Instant Face Tightening & Reduce Wrinkles,Fa-ce Ser-um,Skin Tightening Cream for F-ace,Wrinkle",BRDd324c254,CAT722a51fb,,
PRD8119faba,Byoma Phyto-Mucin Glow Serum,BRD7bbe49b4,CAT722a51fb,,
PRD98ee2489,"Perfect Look London 12% Vitamin C Serum – Anti-Aging & Brightening Face Serum with Hyaluronic Acid, Vitamin B5 & E – Reduces Dark Spots, Wrinkles &",BRD42177e30,CAT722a51fb,,
PRDc3039d7e,Medik8 Super C Ferulic Serum,BRD575597d7,CAT722a51fb,,
PRDef04052b,Roc Fill + Treat Serum,BRD8f4462fb,CAT722a51fb,,
PRD1bef09dd,Medik8 Copper PCA Peptides,BRD11f7a19f,CAT722a51fb,,
PRD7b20811f,Mixsoon Glacier Water Hyaluronic Acid Serum,BRD7d3ee7ce,CAT722a51fb,,
PRD65fc783b,"Discoloration Correcting Serum, Dark Spot Remover for Face, Brightening Serum with Niacinamide, Alpha Arbutin & Centella, Hydrating Face Serum to",BRD2bef0dbc,CAT722a51fb,,
PRD5c7f0414,Bioderma Sensibio Defensive Serum,BRD68460f8b,CAT722a51fb,,
PRDf3e0799a,"Finone-s Skin Vitamin Serum, 5 in 1 Face Serum, Finone-s Full Face and Body Serums, Lifting Firming Essence with Hyaluronic Acid, Collagen, Hydrate",BRD3f92e267,CAT722a51fb,,
PRD555f63c2,Sarah Chapman C1 Serum,BRD14e9b65e,CAT722a51fb,,
PRDc648c100,"Finones Skin Vitamin Serum, Finones Full Face and Body Serum, 5 In 1 Anti Wrinkle Firming Serums, Wrinkle Lifting and Firming Essence with",BRD01841d3f,CAT722a51fb,,
PRDa8447757,Dr Sebagh Serum Repair,BRD6a133265,CAT722a51fb,,
PRD62fe29d1,Peach & Lily Glass Skin Refining Serum,BRD53841c6e,CAT722a51fb,,
PRD3dadbca0,"Boto-x Stock Solution Facial Serum , Boto-x Stock Anti Aging Serum for Face, Instant Face Tightening Boto-x, Reduce Fine Lines, Wrinkles, Boost",BRD3e70aaf3,CAT722a51fb,60.0,ml
PRDbc54c598,Tatcha The Dewy Serum,BRD1a9af619,CAT722a51fb,,
PRD84957534,"Cyano Pink Spicule Serum, Anti Wrinkle Serum for Face, Smoothing And Hydrating Face Serum For All Types Skin (, A)",BRDd4d1d117,CAT722a51fb,30.0,ml
PRD2f3326c0,Skin Rocks The Hyperpigmentation Serum,BRD55a56ab0,CAT722a51fb,,
PRD85664683,"Olavitas Serum Set, Olavitas Liquid Solution, BotO-X Face Serum, Stock Solution Facial Care for Anti Aging Smooth Reduce Fine Lines and",,CAT722a51fb,3.0,pcs
PRD926f4162,Even-Complexion Serum,BRD2bb77bd6,CAT722a51fb,,
PRD7c3d6ed7,"No7 Restore & Renew Face, Neck and Multi Action Serum",BRDd8fb632c,CAT722a51fb,,
PRDb2cdb334,alumiermd Ultimate Boost Serum,,CAT722a51fb,,
PRDbd9c650c,APLB Ferulic Acid Ampoule Serum,BRD3927b75a,CAT722a51fb,,
PRD9d3c1b04,Arencia Deep Water Surge Serum 30,BRD19506f71,CAT722a51fb,,
PRD090837f0,"Rejuvenate Resurfacing Face Serum,Anti Aging Serum for Women,Antipigmentation Face Serum for Men&Women,Rejuvenate Skin Care,Face Hydrating Serum",BRDc8e8c646,CAT722a51fb,,
PRDf706db21,Sukin Natural Actives Brightening Serum,BRD51a402d8,CAT722a51fb,,
PRD943f343b,The INKEY List Serums Ectoin Hydro-Barrier Serum,BRD348d9ff9,CAT722a51fb,,
PRD06baf3ed,Nanoil Face Serum,BRD9c78e10b,CAT722a51fb,,
PRDcf152d7f,Benecos Face Serum,BRD55d1f7cf,CAT722a51fb,,
PRDd2949590,Paula's Choice Clinical Serum,BRD793e8c8e,CAT722a51fb,,
PRD015cf732,öka Clear Complexion Gel Serum Acne-Prone Skin,,CAT722a51fb,,
PRDa65fc7aa,Ioma Ultimate Generous Serum (Pack of 2),BRDc9efaf00,CAT722a51fb,15.0,ml
PRD3a0a59aa,BOOST LAB Multi-Peptide Anti-Ageing Serum,BRDa6bc3a8e,CAT722a51fb,,
PRD3ecd59f4,"Liquid Bo-tox Serum, Boto-xLiquid Solution - Liquid Wrinkle Reduction,Boto-x Liquids Solution Serum, Anti Aging Facial Serum, Reduce Fine",,CAT722a51fb,2.0,pcs
PRD911f05a9,"Finones Skin Vitamin Serum, 5 in 1 Anti Wrinkle Firming Serum, Full Face and Body Serums, Nourishing and Hydrating, Reduce Fine Lines (13cm, )",BRD01841d3f,CAT722a51fb,2.0,pcs
PRDc3be8ff7,grüum Youth Restoring Skin Gel Serum Face Glow Anti aging Vitamin C Serum for Women with Hyaluronic Acid,,CAT722a51fb,30.0,ml
PRD54328f62,Weleda Blue Gentian & Edelweiss Contouring Face Serum,BRD07cd98c0,CAT722a51fb,,
PRDd18ae6f0,"Boto-x Stock Solution Facial Serum , Boto-x Stock Anti Aging Serum For Face, Instant Face Tightening Boto-x, Reduce Fine Lines, Wrinkles",BRD3e70aaf3,CAT722a51fb,120.0,ml
PRD80869a1b,Emma Lewisham Skin Reset Face Serum,BRD1a446afe,CAT722a51fb,,
PRD8cc38a4d,The INKEY List SuperSolutions 10% Azelaic Acid Serum,BRD348d9ff9,CAT722a51fb,,
PRDabc768df,Oskia Get Up & Glow,BRD649c2bf9,CAT722a51fb,,
PRDd02108b9,Yepoda The C-Boost Hero Brightening Serum,BRDbb1f4145,CAT722a51fb,,
PRD161bbecc,Thayers Double Action Acne Serum,BRD5a0f95c7,CAT722a51fb,,
PRDb87918cf,No7 Radiance 15% Vitamin C Serum,BRD5819cb5d,CAT722a51fb,25.0,ml
PRD6164d64d,Caia Cosmetics Beauty Shot Face Serum,BRD8c0c4afd,CAT722a51fb,,
PRD93e261e7,Ole Henriksen Peach Glaze Glow Niacinamide Serum,BRDb7139e52,CAT722a51fb,,
PRDd3f211ee,Aqualogica Glow+ Concentrate Face Serum With Hyaluronic Acid & Vitamin C,BRD84d3fa2c,CAT722a51fb,,
PRD026ca584,Embryolisse Radiant Complexion Serum,BRD00a002a5,CAT722a51fb,,
PRDbec77bbb,Good Intent Radiance Reflect Spray Serum,BRD1c4f779a,CAT722a51fb,,
PRD58f7428b,Nine Less B-Boost Korean Skincare Serum,BRD157657d7,CAT722a51fb,,
PRD60f4ddcf,Dr Sebagh Supreme Maintenance Youth Serum,BRD6a133265,CAT722a51fb,,
PRD9b33088b,Sculpted By Aimee HydraGlo Serum,BRDa78917b8,CAT722a51fb,,
PRD30d7369b,Cosmedica Skincare Pure Hyaluronic Acid Serum,BRDf3cf753d,CAT722a51fb,,
PRD8dad10bb,Geek & Gorgeous 101 HA 5 Light Serum,BRD13f3648e,CAT722a51fb,5.0,l
PRD10c1b173,"ROSVANEE 5% Hyaluronic Acid Serum with Panax Ginseng, Hydrating, Moisturizing & Plumping, Strengthens Skin Barrier with 1% Vitamin B5",BRD39d1a944,CAT722a51fb,60.0,ml
PRD2f75337e,bielenda professional Bielenda ultra-hydrating face serum,,CAT722a51fb,30.0,ml
PRDdea170fe,New Glass Glow Pore Serum Mini,BRD6a6ece02,CAT722a51fb,,
PRDcc07a90b,Yepoda The Glow Hero Serum,BRDbb1f4145,CAT722a51fb,,
PRD78560333,Art Naturals Hyaluronic Acid Serum,BRD89ac496f,CAT722a51fb,,
PRD53444e49,Guinot Nutri Cellulaire Face Serum,BRD6e3d2e87,CAT722a51fb,30.0,ml
PRDa7038b8c,L'Occitane Immortelle Divine Serum,BRDe6552b80,CAT722a51fb,,
PRD1a20adc3,Polyglutamic Acid Serum The INKEY List,BRDb752db6a,CAT722a51fb,,
PRD7a2dc25d,Jaxon Lane Super Serum Face Serum,BRD2ac7311e,CAT722a51fb,,
PRD3d30a1ad,Super Antioxidant Serum,BRDcd21513a,CAT722a51fb,,
PRD737f2237,Geek & Gorgeous A-Game 10 0.1% Retinal Serum,BRD13f3648e,CAT722a51fb,,
PRD80e6e578,Olavitas Serum Set,BRDd3e50834,CAT722a51fb,,
PRD36c44ee6,ROSVANEE 5% Hyaluronic Acid Serum with Panax Ginseng,BRD39d1a944,CAT722a51fb,60.0,ml
PRDf4873185,Jumiso All Day Brightening & Balancing Facial Serum,BRD74bf0021,CAT722a51fb,,
PRD34fead44,Catrice Hydro Supercharged Serum,BRD945d553b,CAT722a51fb,,
PRDeb2f343c,Finones 5 in 1 Anti Wrinkle Firming Serum,BRD2b0ebc88,CAT722a51fb,,
PRD6f42670e,Rejuvenate Anti Aging Face Serum,BRDeece1bc0,CAT722a51fb,,
PRD023a31a8,Finones Full Face and Body Serum,BRDf4f2ffb9,CAT722a51fb,,
PRDc9ff77d3,Brightening Face Serum,BRDc2d3672d,CAT722a51fb,15.0,ml
PRDe27b9f7a,+maskology Hyaluronic Acid Daily Serum,,CAT722a51fb,,
PRDe57b6209,"Anti-aging Facial Serum, Face Lifting For All Skin Types, Stock",BRDb1c36113,CAT722a51fb,,
PRD3af1cf3e,Mary & May Hyaluronics Serum,BRDe39e74fb,CAT722a51fb,,
PRD0be0c44d,Balance Facial Serum,BRDd873031c,CAT722a51fb,,
PRD19c511c5,Brightening Serum,BRD83e119b8,CAT722a51fb,30.0,ml
PRD3d205af2,Sol de Janeiro Delicia Drench Body Butter,BRD9a60d9d8,CAT73647004,,
PRDff85511b,Sanctuary Spa Signature Collection Body Butter,BRD81586a90,CAT73647004,,
PRD45c3d4af,I Love Raspberry and Blackberry Nourishing Body Butter,BRDc950d024,CAT73647004,,
PRDd4a6232d,Soap & Glory The Righteous Butter Body Butter,BRDc740969b,CAT73647004,,
PRD6440e854,Hawaiian Tropic After Sun Body Butter,BRDd0126484,CAT73647004,,
PRDc04de7e2,Treaclemoon Brazilian Love Body Butter,BRDceb99f61,CAT73647004,,
PRDff02931a,No7 Beautiful Skin Intensive Body Butter,BRDb2225ed7,CAT73647004,,
PRD15ab61d2,Q+A Collagen Body Butter,BRD870edef2,CAT73647004,,
PRDe3037209,Luxplus Argan Oil Body Butter,BRD58e0bf35,CAT73647004,,
PRDdc82cf00,Naturium The Glow Getter Multi-Oil Body Butter,BRDbbf5ddd4,CAT73647004,,
PRDeef82c5e,Boba Tea Body Butter Gift Set,BRD6e75e132,CAT73647004,,
PRDeab50d9c,Derma V10 Coconut Body Butter,BRD090855c9,CAT73647004,,
PRDb1afd876,Dr. Organic Aloe Vera Body Butter,BRDde0ae715,CAT73647004,,
PRDbb356a4b,A Little Something Fine Florals Body Butter Trio,BRDd945db6c,CAT73647004,,
PRD27b7a18a,Lemon Berry Barn Coconut Calm Body Butter,BRD87c913e6,CAT73647004,,
PRD5a330cc2,Dirty Works The Big Softie Body Butter,BRDe7402b88,CAT73647004,,
PRD67541c15,Tree Hut Watermelon Whipped Body Butter,BRD73adf0a2,CAT73647004,,
PRD16b8ca29,Palmer's Cocoa Butter Formula Body Cream,BRDca76801e,CAT73647004,,
PRDe8fdc788,Garnier Body Superfood Cocoa & Ceramide Repairing Body Butter,BRD162d58fc,CAT73647004,,
PRD86fa9c35,Soap & Glory Smoothie Star Body Buttercream,BRDc740969b,CAT73647004,,
PRDd987acec,Sanctuary Spa Body Butter,BRD81586a90,CAT73647004,,
PRDb3c00755,The White Company Seychelles Body Butter,BRD58f340fd,CAT73647004,,
PRD39cf64da,Tree Hut Unisex Whipped Body Butter,BRD73adf0a2,CAT73647004,,
PRDf847be93,Lush Super Milk Body Butter,BRD7b854c2a,CAT73647004,,
PRD6514d043,Skin Saints Body Butter Sweet Flowers,BRD17ae79e6,CAT73647004,200.0,ml
PRDabe338e5,The Naked Bee Orange Blossom Honey Ultra Rich Body Butter,BRD4678344c,CAT73647004,,
PRDad80f5ee,Soap & Glory Limited Edition Body Butter Cherry Wild,BRDc740969b,CAT73647004,200.0,ml
PRDb30bd2bd,Evolve Tropical Blossom Body Butter,BRD1075c055,CAT73647004,,
PRDf2b13eb3,I Love Coconut & Cream Body Butter,BRDc950d024,CAT73647004,,
PRD2885a858,Nala's Baby Body Butter Duo Gift Set,BRD14a5582b,CAT73647004,,
PRD5804a148,Dove Nourishing Body Care Pro Age Body Butter,BRD47bdda66,CAT73647004,,
PRD5e6c733f,Glow Golden Vanilla & Warm Sandalwood Body Butter,BRD9745ea85,CAT73647004,250.0,ml
PRDcf787c65,The Retreat Nourishing Body Butter,BRD1c03405a,CAT73647004,,
PRD65bc611e,FUSHI Organic Shea Butter,BRDdaa1ed0c,CAT73647004,,
PRDaadde9dc,Treaclemoon Our Glorious Body Butters,BRDe9a8de1b,CAT73647004,,
PRD78142e75,Sanctuary Spa Signature Natural Oils Melting Pearl Body Butter,BRD81586a90,CAT73647004,300.0,ml
PRD9f935292,Sanctuary Spa Golden Sandalwood Melting Body Butter,BRD81586a90,CAT73647004,,
PRD89920e10,Soap & Glory The Righteous Butter Body Lotion,BRDc740969b,CAT73647004,,
PRD75320a01,NCLA Beauty NCLA Hi Butter Birthday Cake Body Butter Discovery Boots,BRD27b5b1cb,CAT73647004,,
PRDc6f3e9cf,Vaseline Intensive Care Body Butter Cocoa Radiant,BRD1b97ad5a,CAT73647004,,
PRD5046284b,Boots Extracts Mango Body Butter,BRD66624750,CAT73647004,,
PRD8a0cae3f,Savage Body Butter,BRDff6a666f,CAT73647004,80.0,g
PRD2ef57807,Holler and Glow Bondi Pink Dragonfruit Body Butter,BRDb648176f,CAT73647004,,
PRD3dc73759,Burst Bodycare Coconut Body Butter,BRDc8b94e77,CAT73647004,,
PRD8df08659,ÂME Pure Exotic Coco Colada Body Butter,BRD5b77ae18,CAT73647004,,
PRD1d45e618,Palmer's Cocoa Butter Massage Cream for Stretch Marks,BRDca76801e,CAT73647004,,
PRDaab68ee9,So...? Sorry Not Sorry Spread The Love Body Butter,BRDe8b23cdc,CAT73647004,,
PRDd1af292a,Vegan Friendly Fragrance Free 100% Natural Cocoa'Shea Body Butter,BRDb335f034,CAT73647004,,
PRD3ddd785c,Tarte Whipped Body Butter Cake Butter,BRD23ba8a49,CAT73647004,,
PRDf0ed9a02,Grapefruit Dandelion Tangerine Body Butter,BRD8efecabb,CAT73647004,,
PRD629359db,"Crowned Skin Body Butter for Men,Crowned Skin Cologne Body Butter, Crowned Skin King Organic Cologned Body Butter - Warm Scent,Skin Balancing Jojoba",BRD9680c3d4,CAT73647004,,
PRDc2aad00e,Susanne Kaufmann Body Butter,BRD8d670808,CAT73647004,,
PRDe20ca495,Burst Bodycare Orange Body Butter,BRDc8b94e77,CAT73647004,200.0,ml
PRDc03be7d5,Joonbyrd Sunday Sofa Body Butter Mini,BRDfa1981b4,CAT73647004,,
PRDaade8b32,Garnier Intensive 7 Days Shea Butter Body Lotion,BRD162d58fc,CAT73647004,,
PRD2844c525,White Jasmine Brighten Rich Body Butter,BRD3f38b5ec,CAT73647004,,
PRD6db441c9,Organic Body Butter Rose Geranium,BRDe151dde0,CAT73647004,,
PRD9a7c544d,Give Me Body Butter Cream Caramel Vacay,BRD05ca013d,CAT73647004,200.0,ml
PRD44fdf8e1,The Body Shop Strawberry Body Butter,BRD255ab7ee,CAT73647004,,
PRD4dc58d57,Bare and Bloom Spiced Cocoa & Orange Luxury Whipped Vegan Body Butter,BRD1a46b4cd,CAT73647004,,
PRD29798c85,Shea Moisture Sheamoisture Coconut & Hibiscus Body Butter,BRDaa34cd19,CAT73647004,,
PRD84053db9,Yes Studio Self Love Body Butter,BRDe3772f96,CAT73647004,,
PRDbcc1cf6e,Tuttotondo Fico d' India Body Butter,BRD54c8d3d1,CAT73647004,,
PRD681ebc96,The Edinburgh Natural Skincare Company Ltd. Luxury No.1 Whipped Body Butter,BRD188faac4,CAT73647004,,
PRD8bc26847,Yes Studio Body Butter Cherry + Collagen,BRDe3772f96,CAT73647004,400.0,g
PRD8c0d1dc9,Dorothy Perkins Unisex Carbon Poppy Body Butter,BRDb98e5474,CAT73647004,,
PRD300b7217,Organic Creamy Argan Body Butter Unscented,BRDd076bbf9,CAT73647004,240.0,ml
PRD63e1647b,Sainsbury's Little Ones Naturals Body Butter,BRD1f0f3850,CAT73647004,,
PRD9d22c786,Twisted Earth Fluffy Marshmallow Shea Body Butter,BRD8f1b4456,CAT73647004,,
PRD1e986f30,Natura Siberica Sauna & Spa Body Butter,BRD6ca0b79a,CAT73647004,,
PRD0ab251f5,SBC Manuka Honey and Orange Blossom Body Butter,BRDccc27a68,CAT73647004,,
PRDe7df6d91,Cosmos Organic Green Cream Body Butter,BRD6fd35a41,CAT73647004,,
PRD42406e7c,The Body Shop Satsuma Body Butter,BRD255ab7ee,CAT73647004,,
PRD6f4bb908,Organic Polynesian Whipped Body Butter,BRDb0ea1aa7,CAT73647004,,
PRD9272bf59,Coconut & Vanilla Body Butter Mini,BRD540e009b,CAT73647004,,
PRD08a0d5b3,Air Whipped Mango Body Butter,BRDdb7d2fc4,CAT73647004,,
PRD333760a4,ZIAJA Goat's Milk Body Butter,BRDc2162253,CAT73647004,,
PRD90ede740,Burst Bodycare Cherry Body Butter,BRDc8b94e77,CAT73647004,,
PRD53236413,Heather Brae Hand & Body Butter,BRD1b28934e,CAT73647004,,
PRD1bc64c15,"Whipped Body Butter Lemon, Black Pepper and Litsea Cubena",BRD780e2e13,CAT73647004,,
PRD36556a73,Wideye Body Butter,BRDc0492d72,CAT73647004,,
PRD5605eeb6,Butter Raspberry Mini Body,BRD3c425751,CAT73647004,,
PRD604b6fdd,Lush Coconut Body Butter,BRD119b6e5b,CAT73647004,,
PRDb590ea22,Susanne Kaufmann Body Butter for the Senses,BRD8d670808,CAT73647004,,
PRDe55eb32e,Get Fresh Hydrating Body Butter Lemongrass,BRD60e379fa,CAT73647004,225.0,g
PRDd4568156,Liz Earle Skin Replenishing Body Balm,BRDdec588c4,CAT73647004,,
PRD95ed7442,L'Occitane Shea Ultra Rich Body Cream,BRD5f18b132,CAT73647004,,
PRD483d440c,Butter Fairy Dust Mini Body,BRD053d030e,CAT73647004,,
PRD888f8003,Kutis Naked Unscented Body Butter,BRD181201d3,CAT73647004,,
PRD0c593676,Dorothy Perkins Unisex White Jasmine Brighten & Treat Rich Body Butter,BRDb98e5474,CAT73647004,,
PRD3e1c4be3,Cuccio Naturale Lyte Ultra-Sheer Body Butter,BRDaef522fc,CAT73647004,,
PRD58a003fd,Fair Squared Shea Body Butter,BRDd86a1c2e,CAT73647004,,
PRD9315b0f5,Douvalls Body Butter,BRD886843f0,CAT73647004,240.0,ml
PRD8bf9c6bb,Get Fresh Memories of Paris Hydrating Body Butter,BRD60e379fa,CAT73647004,,
PRD7053c485,Whipped Mango Body Butter,BRDb8d1eacb,CAT73647004,,
PRD01f73956,I Love Wellness Sleep Body Butter,BRDc950d024,CAT73647004,,
PRD8e2c4ec7,SBC Skincare Hydra-Collagen Body Butter,BRD0817808c,CAT73647004,,
PRD2b01ece4,Body Butter,BRD73647004,CAT73647004,,
PRD84258f52,PraNaturals Organic Shea Butter,BRD3b3aca19,CAT73647004,300.0,ml
PRDeac6e24e,Shea Rich Body Butter,BRD445f9c6f,CAT73647004,,
PRDe3ce2fbd,Sunkissed Butter Whip Tropical Bliss Body Butter,BRD4020c2b1,CAT73647004,,
PRD3b57229f,White Limetta & Aloe Vera Lyte Body Butter,BRD6ef2f794,CAT73647004,,
PRD6cf31373,Cocosolis Nougat Sparkling Body Butter,BRDcd47a631,CAT73647004,,
PRD88ac69a4,The Spa Natural Body Butter Ylang Ylang and Bergamot Scented,BRD232f46be,CAT73647004,200.0,g
PRD1d06c2a6,Mystic Earth Hand & Body Butter,BRDeb8de37d,CAT73647004,,
PRDeefce813,Cuccio Naturale Lyte Body Butter,BRDaef522fc,CAT73647004,,
PRD8a71614b,Shea Butter – Refined Resealable Pouch,BRD22d23b78,CAT73647004,,
PRDe160f662,Luxurious Oud Rose Body Butter,BRD75392b75,CAT73647004,,
PRD56343a34,Monsoon Deep Hydration Glow Body Butter,BRD539ac6d2,CAT73647004,,
PRD0ed721d3,Way of Life Be Blessed Body Butter,BRD54407ff8,CAT73647004,,
PRDb1eb50f8,Highborn London Natural Luminosity Body Butter,BRD38bacafa,CAT73647004,,
PRDd5fd6083,Highborn London Natural Luminosity Age- Defying Moisturising Body Butter,BRD38bacafa,CAT73647004,,
PRD5417e7e3,Glimmer Goddess Organic Whipped Body Butter Honeysuckle Vegan 24 Hr Hydration,BRDcbc9269c,CAT73647004,,
PRD0bc9f5d6,Evolve - Tropical Blossom Organic Body Butter,BRD022b83d0,CAT73647004,120.0,ml
PRD36202b76,Paula's Choice Ultra-Rich Soothing Body Butter,BRD793e8c8e,CAT73647004,,
PRD8ddeb742,Palmer's Cocoa Butter Formula Lotion,BRDca76801e,CAT73647004,,
PRD5dfa044b,I Heart Revolution Cocoa Pebbles Body Butter,BRDb23dfbac,CAT73647004,,
PRD907b312c,Chamomile Body Butter,BRD91951498,CAT73647004,,
PRD8959db3c,Angel's Delight Soft and Sweet Body Butter,BRD2bb76790,CAT73647004,,
PRD2c50f2fe,Greenwich Bay - . Botanical Body Butter - Sicily,BRD40c2565e,CAT73647004,8.0,oz
PRD6d8765b3,Bielenda Vegan Smoothie Body Balm Watermelon & Banana,BRD1cc0a508,CAT73647004,,
PRDf776ab07,Greenwich Bay - . Botanical Body Butter - Morocco,BRD40c2565e,CAT73647004,8.0,oz
PRDbebe0706,Dirty Works Bahama Balm Coconut Body Balm,BRDe7402b88,CAT73647004,,
PRDd1c74be3,Banana and Coconut Coconut Body Butter,BRDe6f9c347,CAT73647004,,
PRD88f67225,Organic Shop Nurturing Body Cream Blueberry & Blackberry,BRD47539b2f,CAT73647004,250.0,ml
PRD1de0bf82,Sanoll Körperbutter Shea-Vanille,BRD1364029c,CAT73647004,,
PRDd99cfc5a,Makeup Revolution Revolution X Friends Espresso Body Butter,BRD4675142c,CAT73647004,,
PRD11ad67ec,Nakery Beauty SkinRepair Body Butter,BRD81db4af5,CAT73647004,300.0,ml
PRD2a646033,Argan Whipped Body Butter,BRDdff090cf,CAT73647004,,
PRDd9470f19,Soy Body Butter,BRDfe6acea0,CAT73647004,,
PRD16238d9d,Balancing Body Butter - Natural Skincare | Organics.com,BRDf12b2e27,CAT73647004,60.0,ml
PRDe4359c91,Formula 10.0.6 My Softer Side Hydrating Body Butter,BRD313a6a3d,CAT73647004,200.0,ml
PRD7158cfb1,American Dream Cocoa Butter Body Cream,BRDeb9b2fd1,CAT73647004,,
PRD010276af,Fleur de Tiaré Body Butter,,CAT73647004,200.0,ml
PRD7f59a53c,"Lavender Body Butter, Fresh Whipped Shea Butter, Fluffy Body Butter",BRD7dbd479a,CAT73647004,,
PRD00b093a2,Bryan & Candy New York Cocoa Shea Body Butter 200gm,BRDd7ed9d71,CAT73647004,200.0,g
PRDf08bf423,Skybottle Blue Agave Body Butter,BRDfcb12f90,CAT73647004,,
PRD988c621d,Revlon Shea + Almond Oil Moisturizing Body Butter 12fl Oz Coconut,BRDab17a7b1,CAT73647004,,
PRDb8270191,Palmer's Cocoa Butter Formula Moisturizer Jar With Vitamin E - Lot of 3,BRDca76801e,CAT73647004,,
PRDaf1b52a4,Vianek Intensively Soothing Body Butter,BRDdc039d63,CAT73647004,,
PRDc495723b,American Touch Cocoa Butter Body Cream,BRDcae2fdd0,CAT73647004,,
PRDca71bc3a,Natural Body Butter,BRD5b4f9ae8,CAT73647004,,
PRD6e7a0555,Greenwich Bay Destination Body Butter - Kyoto- Cherry Blossom &,BRD40c2565e,CAT73647004,8.0,oz
PRDe6fa2036,Vianek Energizing Body Butter,BRD1a863d7f,CAT73647004,,
PRDc38741ae,Organic Refined Pumpkin Butter,BRD3053f677,CAT73647004,,
PRD09eae9d9,Pure Anada Fresh Cucumber Cocoa Body Butter,BRD7d4cfd10,CAT73647004,,
PRD54ce4ee3,Hype Miami Sun Whipped Body Butter .,BRDd87cdde0,CAT73647004,8.0,oz
PRD2e7bcdda,The Body Shop Avocado Body Butter,BRD255ab7ee,CAT73647004,,
PRD66cf8b02,Argan Whipped Body Butter Bundle,BRDdff090cf,CAT73647004,,
PRD83bc3f62,Kaloderma Body Butter,BRD2875f4b3,CAT73647004,,
PRDb67b6e32,Greenwich Bay - . Botanical Body Butter - Passion Flower,BRD40c2565e,CAT73647004,8.0,oz
PRD4a89a3ef,Tree Hut Moroccan Rose Whipped Body Butter,BRD73adf0a2,CAT73647004,,
PRD052e492a,Ashanti Naturals Juicy Peach Shea Souffle,BRDf6909db0,CAT73647004,,
PRD6669673c,Sol De Janeiro Bom Dia Bright Body Cream,BRDcc92cd4f,CAT73647004,,
PRD0bcc139a,L'Occitane Shea Butter Body Rich Lotion,BRD5f18b132,CAT73647004,,
PRDd5d2dcda,The Body Shop Olive Body Butter,BRD255ab7ee,CAT73647004,,
PRD012276ed,Plum Goodness Get Non-Sticky BodyLovin' Vanilla Vibes Body Butter Mini,BRD19d9dff2,CAT73647004,,
PRDfe307107,Nacomi Mango-Strawberry Body Butter,BRD88f17ecd,CAT73647004,,
PRD1c068a7d,Emma Hardie Moringa Luxury Body Butter,BRD104ca1b4,CAT73647004,,
PRDa470942d,Champneys Citrus Blush Enlivening Body Butter,BRD43e7c129,CAT73647004,,
PRD31475648,Askim Rose Body Butter,BRD102d4ea5,CAT73647004,250.0,g
PRD6886e7c2,Stara Mydlarnia Soft Mango Body Butter Natural 96.8% Moisturizing Body Care Naturally Tailored to Your Skin Nourishing Body Care Perfect,BRDe57c7c65,CAT73647004,200.0,ml
PRDfc62bf90,Sol De Janeiro Delicia Drench Body Butter,BRDcc92cd4f,CAT73647004,,
PRDf45b8685,Scented Body Butter,BRD321dec9e,CAT73647004,,
PRD3ec478bc,Sol De Janeiro Delicia Drench Body Butter Travel,BRDcc92cd4f,CAT73647004,25.0,ml
PRD938b43ab,Andalou Naturals 1000 Roses Velvet Soft Body Butter,BRDaf99b21f,CAT73647004,,
PRD01b6d035,Raw African Shea Butter,BRD5ac3d79c,CAT73647004,,
PRD291d8ca4,Mango Body Butter . (tea Tree Oils Blend),BRDfefcfc75,CAT73647004,2.0,oz
PRD877cfd4c,Caudalie Vine Body Butter,BRDbafb52b9,CAT73647004,,
PRD5f788f03,The Body Shop Almond Milk Body Butter,BRD255ab7ee,CAT73647004,,
PRDa4a9f617,FarmHouse Fresh Marshmallow Melt Shea Butter Cream,BRDfbd1a4f3,CAT73647004,,
PRDd607a78a,Cocoa Body Butter For Radiant And Healthy Skin 100gm,BRD25927391,CAT73647004,100.0,g
PRDbb0b8057,Butter Up Tattoo Aftercare Heals Brightens Tattoos,BRD2d238c15,CAT73647004,,
PRD58080f52,Hempz Original Herbal Body Butter,BRD891141d1,CAT73647004,,
PRD9473d7ab,Beija Flor Elasti-Cream Sol De Janeiro,BRD6f9f08dd,CAT73647004,,
PRD1f16f09f,Desert Essence Body Butter,BRDbd4f42ec,CAT73647004,,
PRDcb51ca07,DATSIT - Organic Body Butter | Handmade | Vegan | Cruelty Free | No Preservatives | No Artificial Ingredients | FLORAL: Lavender & Rose - (),BRD590798af,CAT73647004,150.0,ml
PRD5852e2df,Rizes Crete Body Butter with Olive Oil,BRD6c068981,CAT73647004,,
PRD2cefa654,Mango Butter Refined Resealable Pouch,BRD8e90f8b2,CAT73647004,,
PRDfd087ec4,Mango Body Butter | Deep Moisturising & Skin Repair – Baorri,BRDfefcfc75,CAT73647004,150.0,g
PRD438efbcb,naissance Mango Butter Refined,,CAT73647004,,
PRD492bf45f,Greenwich Bay Trading Company Botanic Body Butter Passion Flower Tub,BRD40c2565e,CAT73647004,8.0,oz
PRD6238d1cd,Lollia Dream Body Butter,BRDf497da0d,CAT73647004,,
PRDb905e752,French Lavender Whipped Body Butter,BRD549800c2,CAT73647004,,
PRD52b8707e,Oshea Herbals Cocoa Butter Body Butter For Dry Itchy Skin,BRD90b556a9,CAT73647004,,
PRDb3ed2fe4,Fun With Soap Shea Butter Refined,BRD9b6a1e1c,CAT73647004,,
PRD3c1c4a62,Absolutely Natural Shea Mango Whipped Body Butter,BRD8ab0f737,CAT73647004,,
PRDa27200a0,Soothing Touch Body Butter Chocolate,BRDffc7d981,CAT73647004,,
PRD0934e0a5,Beach Bliss Summer Solstice Body Butter,BRDd6367410,CAT73647004,,
PRDf037e0b0,American Dream Cocoa Butter Lavender Cream,BRDeb9b2fd1,CAT73647004,500.0,ml
PRD88370d15,EOS Shea Better Body Lotion,BRD03fed16a,CAT73647004,,
PRD9750d87e,Derma V10 Coconut Body Butter Deep Moisturizing & Nourishment - Pack of 12,BRD090855c9,CAT73647004,220.0,ml
PRDdad9b41e,The Body Shop Cocoa Butter Body Butter,BRD255ab7ee,CAT73647004,,
PRD9cc8e37e,2x Sol De Janeiro Delicia Drench Body Butter In Each (),,CAT73647004,25.0,ml
PRD2dbcb8ca,Youth To The People Superberry Firm and Glow Dream Body Butter,BRDd3fd4349,CAT73647004,,
PRDd66fdd91,Bare and Bloom Winter Fir Luxury Whipped Vegan Body Butter,BRD1a46b4cd,CAT73647004,,
PRDe05ac71d,Ava Body Butter,BRD8fd79565,CAT73647004,,
PRDfd91dd5d,Sol De Janeiro Delicia Drench Body Butter ×3 In Mini Travel Sizes,BRDcc92cd4f,CAT73647004,25.0,ml
PRD8e4321fb,Gaia Awakening Body Cream,BRD250da5e5,CAT73647004,,
PRDbc8ea1d8,Majestic Pure Shea Body Butter,BRDcb3d4291,CAT73647004,,
PRD9aca11f6,Pestle & Mortar Nimbu Body Butter,BRDbf1c947b,CAT73647004,,
PRDcccbe24f,"Mango Body Butter – Daily Hydration, Nourishing & Softening Skin Care",BRDfefcfc75,CAT73647004,,
PRD60fb88e0,Body Balm for Menopause Skin,BRD51852f5f,CAT73647004,,
