product_id,product_name,brand_id,category_id,size_value,size_unit
PRD7e605af7,Topiderm Body Butter Fatty Cream,BRDce43759a,CAT73647004,,
PRDdac71ca0,Bare and Bloom Luxury Whipped Vegan Body Butter,BRD1a46b4cd,CAT73647004,,
PRDaceafe87,Sol De Janeiro Delicia Drench Body Butter Travel Size Unopened,BRDcc92cd4f,CAT73647004,25.0,ml
PRD2c59c9ec,Africa's Best Cocoa Butter & Shea Butter Body Cream,BRDa691028e,CAT73647004,,
PRDea187cc5,Better You Magnesium Body Butter,BRD6cea9339,CAT73647004,,
PRDaabefebb,Nature Well Shea Body Butter Variety Pack,BRD5bc84d4a,CAT73647004,,
PRD1fd2e3a0,Cuccio Mango & Bergamot Lyte Body Butter,BRDade2e943,CAT73647004,,
PRD42e4d7b0,Body Prescriptions - Niacinamide & Vitamin C Body Butter,BRDa527841b,CAT73647004,550.0,ml
PRDf1977cc6,Queen Helene Cocoa Butter Face and Body,BRDf4d8cfa4,CAT73647004,,
PRDdcc49fb7,Organic Whipped Lemon Body Butter - Natural Body Butters | Organics.com Rose Geranium /,BRD9f80d363,CAT73647004,120.0,ml
PRDb845461c,Delon Intense Moisturizing Body Butter,BRD6dcf5fea,CAT73647004,,
PRDad74e0eb,Mango Butter,BRD8e90f8b2,CAT73647004,,
PRDa2063a8c,Soap & And Glory The Righteous Body Butter,BRDc740969b,CAT73647004,600.0,ml
PRDc7682a63,UpCircle Body Cream with Date Seeds,BRD6a421f3a,CAT73647004,,
PRD034df574,Donna Valente Body Butter Banana Extract,BRD974b0022,CAT73647004,200.0,ml
PRDe3c955ec,Body Saviour Stretch Mark Body Butter,BRDe0c1b903,CAT73647004,,
PRD45d47d54,DIBIA Patchouli & Cedarwood Whipped Body Butter,BRD07ad5287,CAT73647004,500.0,ml
PRDf21bf0fb,Whipped Wonder Body Butter Cream,BRDcf88a69e,CAT73647004,8.0,oz
PRDb066d215,Inis Body Butter,BRD08166db1,CAT73647004,,
PRD2c60e333,Whipped Shea Body Butter . Jar Strawberry Cheesecake,BRDd2762ffb,CAT73647004,6.0,oz
PRDb2543aab,Lush King of Skin Body Butter,BRDd918eca9,CAT73647004,,
PRD86966426,Shea Olein Luxury Body Butter,BRDcd5234ee,CAT73647004,,
PRDd3acca43,Shea Butter Ultra-rich Moisturizing Body Butter,BRD22d23b78,CAT73647004,2.0,oz
PRD9e304766,Ziaja Cocoa Butter,BRDca980360,CAT73647004,,
PRDabfdfe27,Kedma Gold Nourishing Body Butter,BRD80ba7d20,CAT73647004,,
PRD087440da,Dirty Works Body A Butter Alright Body Butter Set Each,BRDe7402b88,CAT73647004,1.69,oz
PRDb8dee5e4,Crowned Skin King Organic Cologned Body Butter,BRD9680c3d4,CAT73647004,,
PRD495fadb0,Mustika Ratu Coffee Body Butter 200gr - Maintain Skin Firmness And,BRD09f55f6c,CAT73647004,200.0,g
PRD2092064a,Shinning Buddy Whipped Body Butter Watermelon & Marshmallow,BRDdd0303a1,CAT73647004,,
PRD4c5f7386,Big Vanilla Honey Firming + Nourishing Body Butter /,BRD4aa5fd89,CAT73647004,31.0,oz
PRD6f8c14e1,Give Me Body Butter Cream Orchid Dreams Purple,BRD05ca013d,CAT73647004,200.0,ml
PRD7c310680,Cocoa Butter Body Cream Easy To Absorb Enhance Skin Elasticity Deep,BRD90e6527f,CAT73647004,,
PRD3ee3bb68,Volamena Vitamin C Body Butter for Women & Men,BRD757d4d67,CAT73647004,100.0,ml
PRD9c4f4999,Rich Cocoa Butter Body Cream – Deep Hydration Luxurious,BRD01316f7f,CAT73647004,200.0,ml
